"No.","Time","Source","Destination","Protocol","Length","Info"
"1","0.000000000","2409:40e0:51:30ac:48df:8997:7dcc:b2e2","2404:6800:4002:82f::2001","TCP","86","46410  >  443 [ACK] Seq=1 Ack=1 Win=502 Len=0 TSval=2546457058 TSecr=1043462681"
"2","0.009683833","Apple_f2:ed:3a","Broadcast","ARP","42","Who has 192.168.60.70? Tell 192.168.60.233"
"3","0.009701003","Shenzhen_34:c4:a5","Apple_f2:ed:3a","ARP","42","192.168.60.70 is at 1c:bf:ce:34:c4:a5"
"4","0.024963828","192.168.60.233","192.168.60.70","FTP-DATA","93","FTP Data: 39 bytes"
"5","0.024994331","192.168.60.70","192.168.60.233","TCP","54","9999  >  20 [RST, ACK] Seq=1 Ack=40 Win=0 Len=0"
"6","0.032907418","192.168.60.233","192.168.60.70","TCP","93","[TCP Spurious Retransmission] 20  >  9999 [SYN] Seq=0 Win=8192 Len=39"
"7","0.032934414","192.168.60.70","192.168.60.233","TCP","54","9999  >  20 [RST, ACK] Seq=1 Ack=40 Win=0 Len=0"
"8","0.039676276","192.168.60.233","192.168.60.70","TCP","93","[TCP Spurious Retransmission] 20  >  9999 [SYN] Seq=0 Win=8192 Len=39"
"9","0.039701772","192.168.60.70","192.168.60.233","TCP","54","9999  >  20 [RST, ACK] Seq=1 Ack=40 Win=0 Len=0"
"10","0.046771285","192.168.60.233","192.168.60.70","TCP","93","[TCP Spurious Retransmission] 20  >  9999 [SYN] Seq=0 Win=8192 Len=39"
"11","0.046798732","192.168.60.70","192.168.60.233","TCP","54","9999  >  20 [RST, ACK] Seq=1 Ack=40 Win=0 Len=0"
"12","0.050370645","192.168.60.233","192.168.60.70","TCP","93","[TCP Spurious Retransmission] 20  >  9999 [SYN] Seq=0 Win=8192 Len=39"
"13","0.050394134","192.168.60.70","192.168.60.233","TCP","54","9999  >  20 [RST, ACK] Seq=1 Ack=40 Win=0 Len=0"
"14","0.054594275","192.168.60.233","192.168.60.70","TCP","93","[TCP Spurious Retransmission] 20  >  9999 [SYN] Seq=0 Win=8192 Len=39"
"15","0.054615981","192.168.60.70","192.168.60.233","TCP","54","9999  >  20 [RST, ACK] Seq=1 Ack=40 Win=0 Len=0"
"16","0.058256316","192.168.60.233","192.168.60.70","TCP","93","[TCP Spurious Retransmission] 20  >  9999 [SYN] Seq=0 Win=8192 Len=39"
"17","0.058305407","192.168.60.70","192.168.60.233","TCP","54","9999  >  20 [RST, ACK] Seq=1 Ack=40 Win=0 Len=0"
"18","0.063305479","192.168.60.233","192.168.60.70","TCP","93","[TCP Spurious Retransmission] 20  >  9999 [SYN] Seq=0 Win=8192 Len=39"
"19","0.063324803","192.168.60.70","192.168.60.233","TCP","54","9999  >  20 [RST, ACK] Seq=1 Ack=40 Win=0 Len=0"
"20","0.066958771","192.168.60.233","192.168.60.70","TCP","93","[TCP Spurious Retransmission] 20  >  9999 [SYN] Seq=0 Win=8192 Len=39"
"21","0.066989195","192.168.60.70","192.168.60.233","TCP","54","9999  >  20 [RST, ACK] Seq=1 Ack=40 Win=0 Len=0"
"22","0.070323555","192.168.60.233","192.168.60.70","TCP","93","[TCP Spurious Retransmission] 20  >  9999 [SYN] Seq=0 Win=8192 Len=39"
"23","0.070333709","192.168.60.70","192.168.60.233","TCP","54","9999  >  20 [RST, ACK] Seq=1 Ack=40 Win=0 Len=0"
"24","0.073288253","192.168.60.233","192.168.60.70","TCP","93","[TCP Spurious Retransmission] 20  >  9999 [SYN] Seq=0 Win=8192 Len=39"
"25","0.073300057","192.168.60.70","192.168.60.233","TCP","54","9999  >  20 [RST, ACK] Seq=1 Ack=40 Win=0 Len=0"
"26","0.077937518","192.168.60.233","192.168.60.70","TCP","93","[TCP Spurious Retransmission] 20  >  9999 [SYN] Seq=0 Win=8192 Len=39"
"27","0.077950956","192.168.60.70","192.168.60.233","TCP","54","9999  >  20 [RST, ACK] Seq=1 Ack=40 Win=0 Len=0"
"28","0.080746316","192.168.60.233","192.168.60.70","TCP","93","[TCP Spurious Retransmission] 20  >  9999 [SYN] Seq=0 Win=8192 Len=39"
"29","0.080756501","192.168.60.70","192.168.60.233","TCP","54","9999  >  20 [RST, ACK] Seq=1 Ack=40 Win=0 Len=0"
"30","0.082269305","192.168.60.233","192.168.60.70","TCP","93","[TCP Spurious Retransmission] 20  >  9999 [SYN] Seq=0 Win=8192 Len=39"
"31","0.082278469","192.168.60.70","192.168.60.233","TCP","54","9999  >  20 [RST, ACK] Seq=1 Ack=40 Win=0 Len=0"
"32","0.085194450","192.168.60.233","192.168.60.70","TCP","93","[TCP Spurious Retransmission] 20  >  9999 [SYN] Seq=0 Win=8192 Len=39"
"33","0.085206785","192.168.60.70","192.168.60.233","TCP","54","9999  >  20 [RST, ACK] Seq=1 Ack=40 Win=0 Len=0"
"34","0.087886872","192.168.60.233","192.168.60.70","TCP","93","[TCP Spurious Retransmission] 20  >  9999 [SYN] Seq=0 Win=8192 Len=39"
"35","0.087894566","192.168.60.70","192.168.60.233","TCP","54","9999  >  20 [RST, ACK] Seq=1 Ack=40 Win=0 Len=0"
"36","0.090923875","192.168.60.233","192.168.60.70","TCP","93","[TCP Spurious Retransmission] 20  >  9999 [SYN] Seq=0 Win=8192 Len=39"
"37","0.090943369","192.168.60.70","192.168.60.233","TCP","54","9999  >  20 [RST, ACK] Seq=1 Ack=40 Win=0 Len=0"
"38","0.092949214","192.168.60.233","192.168.60.70","TCP","93","[TCP Spurious Retransmission] 20  >  9999 [SYN] Seq=0 Win=8192 Len=39"
"39","0.092965769","192.168.60.70","192.168.60.233","TCP","54","9999  >  20 [RST, ACK] Seq=1 Ack=40 Win=0 Len=0"
"40","0.096808780","192.168.60.233","192.168.60.70","TCP","93","[TCP Spurious Retransmission] 20  >  9999 [SYN] Seq=0 Win=8192 Len=39"
"41","0.096828281","192.168.60.70","192.168.60.233","TCP","54","9999  >  20 [RST, ACK] Seq=1 Ack=40 Win=0 Len=0"
"42","0.099431111","192.168.60.233","192.168.60.70","TCP","93","[TCP Spurious Retransmission] 20  >  9999 [SYN] Seq=0 Win=8192 Len=39"
"43","0.099452443","192.168.60.70","192.168.60.233","TCP","54","9999  >  20 [RST, ACK] Seq=1 Ack=40 Win=0 Len=0"
"44","0.101931192","192.168.60.233","192.168.60.70","TCP","93","[TCP Spurious Retransmission] 20  >  9999 [SYN] Seq=0 Win=8192 Len=39"
"45","0.101952002","192.168.60.70","192.168.60.233","TCP","54","9999  >  20 [RST, ACK] Seq=1 Ack=40 Win=0 Len=0"
"46","0.104591208","192.168.60.233","192.168.60.70","TCP","93","[TCP Spurious Retransmission] 20  >  9999 [SYN] Seq=0 Win=8192 Len=39"
"47","0.104617958","192.168.60.70","192.168.60.233","TCP","54","9999  >  20 [RST, ACK] Seq=1 Ack=40 Win=0 Len=0"
"48","0.106111301","192.168.60.233","192.168.60.70","TCP","93","[TCP Spurious Retransmission] 20  >  9999 [SYN] Seq=0 Win=8192 Len=39"
"49","0.106129195","192.168.60.70","192.168.60.233","TCP","54","9999  >  20 [RST, ACK] Seq=1 Ack=40 Win=0 Len=0"
"50","0.115684691","192.168.60.233","192.168.60.70","TCP","93","[TCP Spurious Retransmission] 20  >  9999 [SYN] Seq=0 Win=8192 Len=39"
"51","0.115720636","192.168.60.70","192.168.60.233","TCP","54","9999  >  20 [RST, ACK] Seq=1 Ack=40 Win=0 Len=0"
"52","0.115816716","192.168.60.233","192.168.60.70","TCP","93","[TCP Spurious Retransmission] 20  >  9999 [SYN] Seq=0 Win=8192 Len=39"
"53","0.115828895","192.168.60.70","192.168.60.233","TCP","54","9999  >  20 [RST, ACK] Seq=1 Ack=40 Win=0 Len=0"
"54","0.116126240","192.168.60.233","192.168.60.70","TCP","93","[TCP Spurious Retransmission] 20  >  9999 [SYN] Seq=0 Win=8192 Len=39"
"55","0.116145334","192.168.60.70","192.168.60.233","TCP","54","9999  >  20 [RST, ACK] Seq=1 Ack=40 Win=0 Len=0"
"56","0.124710022","192.168.60.233","192.168.60.70","TCP","93","[TCP Spurious Retransmission] 20  >  9999 [SYN] Seq=0 Win=8192 Len=39"
"57","0.124756070","192.168.60.70","192.168.60.233","TCP","54","9999  >  20 [RST, ACK] Seq=1 Ack=40 Win=0 Len=0"
"58","0.127094493","192.168.60.233","192.168.60.70","TCP","93","[TCP Spurious Retransmission] 20  >  9999 [SYN] Seq=0 Win=8192 Len=39"
"59","0.127155108","192.168.60.70","192.168.60.233","TCP","54","9999  >  20 [RST, ACK] Seq=1 Ack=40 Win=0 Len=0"
"60","0.129674223","192.168.60.233","192.168.60.70","TCP","93","[TCP Spurious Retransmission] 20  >  9999 [SYN] Seq=0 Win=8192 Len=39"
"61","0.129704710","192.168.60.70","192.168.60.233","TCP","54","9999  >  20 [RST, ACK] Seq=1 Ack=40 Win=0 Len=0"
"62","0.132008221","192.168.60.233","192.168.60.70","TCP","93","[TCP Spurious Retransmission] 20  >  9999 [SYN] Seq=0 Win=8192 Len=39"
"63","0.132044015","192.168.60.70","192.168.60.233","TCP","54","9999  >  20 [RST, ACK] Seq=1 Ack=40 Win=0 Len=0"
"64","0.134467332","192.168.60.233","192.168.60.70","TCP","93","[TCP Spurious Retransmission] 20  >  9999 [SYN] Seq=0 Win=8192 Len=39"
"65","0.134495931","192.168.60.70","192.168.60.233","TCP","54","9999  >  20 [RST, ACK] Seq=1 Ack=40 Win=0 Len=0"
"66","0.137210351","192.168.60.233","192.168.60.70","TCP","93","[TCP Spurious Retransmission] 20  >  9999 [SYN] Seq=0 Win=8192 Len=39"
"67","0.137242084","192.168.60.70","192.168.60.233","TCP","54","9999  >  20 [RST, ACK] Seq=1 Ack=40 Win=0 Len=0"
"68","0.139508708","192.168.60.233","192.168.60.70","TCP","93","[TCP Spurious Retransmission] 20  >  9999 [SYN] Seq=0 Win=8192 Len=39"
"69","0.139551540","192.168.60.70","192.168.60.233","TCP","54","9999  >  20 [RST, ACK] Seq=1 Ack=40 Win=0 Len=0"
"70","0.141929088","192.168.60.233","192.168.60.70","TCP","93","[TCP Spurious Retransmission] 20  >  9999 [SYN] Seq=0 Win=8192 Len=39"
"71","0.141964556","192.168.60.70","192.168.60.233","TCP","54","9999  >  20 [RST, ACK] Seq=1 Ack=40 Win=0 Len=0"
"72","0.144757630","192.168.60.233","192.168.60.70","TCP","93","[TCP Spurious Retransmission] 20  >  9999 [SYN] Seq=0 Win=8192 Len=39"
"73","0.144792157","192.168.60.70","192.168.60.233","TCP","54","9999  >  20 [RST, ACK] Seq=1 Ack=40 Win=0 Len=0"
"74","0.147176952","192.168.60.233","192.168.60.70","TCP","93","[TCP Spurious Retransmission] 20  >  9999 [SYN] Seq=0 Win=8192 Len=39"
"75","0.147212582","192.168.60.70","192.168.60.233","TCP","54","9999  >  20 [RST, ACK] Seq=1 Ack=40 Win=0 Len=0"
"76","0.149433781","192.168.60.233","192.168.60.70","TCP","93","[TCP Spurious Retransmission] 20  >  9999 [SYN] Seq=0 Win=8192 Len=39"
"77","0.149476527","192.168.60.70","192.168.60.233","TCP","54","9999  >  20 [RST, ACK] Seq=1 Ack=40 Win=0 Len=0"
"78","0.151461211","192.168.60.233","192.168.60.70","TCP","93","[TCP Spurious Retransmission] 20  >  9999 [SYN] Seq=0 Win=8192 Len=39"
"79","0.151495387","192.168.60.70","192.168.60.233","TCP","54","9999  >  20 [RST, ACK] Seq=1 Ack=40 Win=0 Len=0"
"80","0.154349515","192.168.60.233","192.168.60.70","TCP","93","[TCP Spurious Retransmission] 20  >  9999 [SYN] Seq=0 Win=8192 Len=39"
"81","0.154412587","192.168.60.70","192.168.60.233","TCP","54","9999  >  20 [RST, ACK] Seq=1 Ack=40 Win=0 Len=0"
"82","0.156574058","192.168.60.233","192.168.60.70","TCP","93","[TCP Spurious Retransmission] 20  >  9999 [SYN] Seq=0 Win=8192 Len=39"
"83","0.156621051","192.168.60.70","192.168.60.233","TCP","54","9999  >  20 [RST, ACK] Seq=1 Ack=40 Win=0 Len=0"
"84","0.159382501","192.168.60.233","192.168.60.70","TCP","93","[TCP Spurious Retransmission] 20  >  9999 [SYN] Seq=0 Win=8192 Len=39"
"85","0.159410479","192.168.60.70","192.168.60.233","TCP","54","9999  >  20 [RST, ACK] Seq=1 Ack=40 Win=0 Len=0"
"86","0.164392503","192.168.60.233","192.168.60.70","TCP","93","[TCP Spurious Retransmission] 20  >  9999 [SYN] Seq=0 Win=8192 Len=39"
"87","0.164425089","192.168.60.70","192.168.60.233","TCP","54","9999  >  20 [RST, ACK] Seq=1 Ack=40 Win=0 Len=0"
"88","0.164594482","192.168.60.233","192.168.60.70","TCP","93","[TCP Spurious Retransmission] 20  >  9999 [SYN] Seq=0 Win=8192 Len=39"
"89","0.164607026","192.168.60.70","192.168.60.233","TCP","54","9999  >  20 [RST, ACK] Seq=1 Ack=40 Win=0 Len=0"
"90","0.166103251","192.168.60.233","192.168.60.70","TCP","93","[TCP Spurious Retransmission] 20  >  9999 [SYN] Seq=0 Win=8192 Len=39"
"91","0.166124274","192.168.60.70","192.168.60.233","TCP","54","9999  >  20 [RST, ACK] Seq=1 Ack=40 Win=0 Len=0"
"92","0.168819134","192.168.60.233","192.168.60.70","TCP","93","[TCP Spurious Retransmission] 20  >  9999 [SYN] Seq=0 Win=8192 Len=39"
"93","0.168845696","192.168.60.70","192.168.60.233","TCP","54","9999  >  20 [RST, ACK] Seq=1 Ack=40 Win=0 Len=0"
"94","0.171114860","192.168.60.233","192.168.60.70","TCP","93","[TCP Spurious Retransmission] 20  >  9999 [SYN] Seq=0 Win=8192 Len=39"
"95","0.171146197","192.168.60.70","192.168.60.233","TCP","54","9999  >  20 [RST, ACK] Seq=1 Ack=40 Win=0 Len=0"
"96","0.173384990","192.168.60.233","192.168.60.70","TCP","93","[TCP Spurious Retransmission] 20  >  9999 [SYN] Seq=0 Win=8192 Len=39"
"97","0.173412644","192.168.60.70","192.168.60.233","TCP","54","9999  >  20 [RST, ACK] Seq=1 Ack=40 Win=0 Len=0"
"98","0.175638914","192.168.60.233","192.168.60.70","TCP","93","[TCP Spurious Retransmission] 20  >  9999 [SYN] Seq=0 Win=8192 Len=39"
"99","0.175661797","192.168.60.70","192.168.60.233","TCP","54","9999  >  20 [RST, ACK] Seq=1 Ack=40 Win=0 Len=0"
"100","0.180323181","192.168.60.233","192.168.60.70","TCP","93","[TCP Spurious Retransmission] 20  >  9999 [SYN] Seq=0 Win=8192 Len=39"
"101","0.180359232","192.168.60.70","192.168.60.233","TCP","54","9999  >  20 [RST, ACK] Seq=1 Ack=40 Win=0 Len=0"
"102","0.180525289","192.168.60.233","192.168.60.70","TCP","93","[TCP Spurious Retransmission] 20  >  9999 [SYN] Seq=0 Win=8192 Len=39"
"103","0.180539136","192.168.60.70","192.168.60.233","TCP","54","9999  >  20 [RST, ACK] Seq=1 Ack=40 Win=0 Len=0"
"104","0.183409323","192.168.60.233","192.168.60.70","TCP","93","[TCP Spurious Retransmission] 20  >  9999 [SYN] Seq=0 Win=8192 Len=39"
"105","0.183452359","192.168.60.70","192.168.60.233","TCP","54","9999  >  20 [RST, ACK] Seq=1 Ack=40 Win=0 Len=0"
"106","0.185723898","192.168.60.233","192.168.60.70","TCP","93","[TCP Spurious Retransmission] 20  >  9999 [SYN] Seq=0 Win=8192 Len=39"
"107","0.185749505","192.168.60.70","192.168.60.233","TCP","54","9999  >  20 [RST, ACK] Seq=1 Ack=40 Win=0 Len=0"
"108","0.187938145","192.168.60.233","192.168.60.70","TCP","93","[TCP Spurious Retransmission] 20  >  9999 [SYN] Seq=0 Win=8192 Len=39"
"109","0.187960965","192.168.60.70","192.168.60.233","TCP","54","9999  >  20 [RST, ACK] Seq=1 Ack=40 Win=0 Len=0"
"110","0.190690017","192.168.60.233","192.168.60.70","TCP","93","[TCP Spurious Retransmission] 20  >  9999 [SYN] Seq=0 Win=8192 Len=39"
"111","0.190725610","192.168.60.70","192.168.60.233","TCP","54","9999  >  20 [RST, ACK] Seq=1 Ack=40 Win=0 Len=0"
"112","0.192794110","192.168.60.233","192.168.60.70","TCP","93","[TCP Spurious Retransmission] 20  >  9999 [SYN] Seq=0 Win=8192 Len=39"
"113","0.192830650","192.168.60.70","192.168.60.233","TCP","54","9999  >  20 [RST, ACK] Seq=1 Ack=40 Win=0 Len=0"
"114","0.195092573","192.168.60.233","192.168.60.70","TCP","93","[TCP Spurious Retransmission] 20  >  9999 [SYN] Seq=0 Win=8192 Len=39"
"115","0.195139404","192.168.60.70","192.168.60.233","TCP","54","9999  >  20 [RST, ACK] Seq=1 Ack=40 Win=0 Len=0"
"116","0.197800425","192.168.60.233","192.168.60.70","TCP","93","[TCP Spurious Retransmission] 20  >  9999 [SYN] Seq=0 Win=8192 Len=39"
"117","0.197828912","192.168.60.70","192.168.60.233","TCP","54","9999  >  20 [RST, ACK] Seq=1 Ack=40 Win=0 Len=0"
"118","0.199380439","192.168.60.233","192.168.60.70","TCP","93","[TCP Spurious Retransmission] 20  >  9999 [SYN] Seq=0 Win=8192 Len=39"
"119","0.199405907","192.168.60.70","192.168.60.233","TCP","54","9999  >  20 [RST, ACK] Seq=1 Ack=40 Win=0 Len=0"
"120","0.202712616","192.168.60.233","192.168.60.70","TCP","93","[TCP Spurious Retransmission] 20  >  9999 [SYN] Seq=0 Win=8192 Len=39"
"121","0.202742347","192.168.60.70","192.168.60.233","TCP","54","9999  >  20 [RST, ACK] Seq=1 Ack=40 Win=0 Len=0"
"122","0.204674857","192.168.60.233","192.168.60.70","TCP","93","[TCP Spurious Retransmission] 20  >  9999 [SYN] Seq=0 Win=8192 Len=39"
"123","0.204709388","192.168.60.70","192.168.60.233","TCP","54","9999  >  20 [RST, ACK] Seq=1 Ack=40 Win=0 Len=0"
"124","0.207916709","192.168.60.233","192.168.60.70","TCP","93","[TCP Spurious Retransmission] 20  >  9999 [SYN] Seq=0 Win=8192 Len=39"
"125","0.207943632","192.168.60.70","192.168.60.233","TCP","54","9999  >  20 [RST, ACK] Seq=1 Ack=40 Win=0 Len=0"
"126","0.216899887","192.168.60.233","192.168.60.70","TCP","93","[TCP Spurious Retransmission] 20  >  9999 [SYN] Seq=0 Win=8192 Len=39"
"127","0.216925662","192.168.60.70","192.168.60.233","TCP","54","9999  >  20 [RST, ACK] Seq=1 Ack=40 Win=0 Len=0"
"128","0.217083755","192.168.60.233","192.168.60.70","TCP","93","[TCP Spurious Retransmission] 20  >  9999 [SYN] Seq=0 Win=8192 Len=39"
"129","0.217092738","192.168.60.70","192.168.60.233","TCP","54","9999  >  20 [RST, ACK] Seq=1 Ack=40 Win=0 Len=0"
"130","0.217295256","192.168.60.233","192.168.60.70","TCP","93","[TCP Spurious Retransmission] 20  >  9999 [SYN] Seq=0 Win=8192 Len=39"
"131","0.217306184","192.168.60.70","192.168.60.233","TCP","54","9999  >  20 [RST, ACK] Seq=1 Ack=40 Win=0 Len=0"
"132","0.217466089","192.168.60.233","192.168.60.70","TCP","93","[TCP Spurious Retransmission] 20  >  9999 [SYN] Seq=0 Win=8192 Len=39"
"133","0.217481719","192.168.60.70","192.168.60.233","TCP","54","9999  >  20 [RST, ACK] Seq=1 Ack=40 Win=0 Len=0"
"134","0.218848104","192.168.60.233","192.168.60.70","TCP","93","[TCP Spurious Retransmission] 20  >  9999 [SYN] Seq=0 Win=8192 Len=39"
"135","0.218881371","192.168.60.70","192.168.60.233","TCP","54","9999  >  20 [RST, ACK] Seq=1 Ack=40 Win=0 Len=0"
"136","0.221856614","192.168.60.233","192.168.60.70","TCP","93","[TCP Spurious Retransmission] 20  >  9999 [SYN] Seq=0 Win=8192 Len=39"
"137","0.221927760","192.168.60.70","192.168.60.233","TCP","54","9999  >  20 [RST, ACK] Seq=1 Ack=40 Win=0 Len=0"
"138","0.224063026","192.168.60.233","192.168.60.70","TCP","93","[TCP Spurious Retransmission] 20  >  9999 [SYN] Seq=0 Win=8192 Len=39"
"139","0.224104024","192.168.60.70","192.168.60.233","TCP","54","9999  >  20 [RST, ACK] Seq=1 Ack=40 Win=0 Len=0"
"140","0.226308080","192.168.60.233","192.168.60.70","TCP","93","[TCP Spurious Retransmission] 20  >  9999 [SYN] Seq=0 Win=8192 Len=39"
"141","0.226353819","192.168.60.70","192.168.60.233","TCP","54","9999  >  20 [RST, ACK] Seq=1 Ack=40 Win=0 Len=0"
"142","0.228275620","192.168.60.233","192.168.60.70","TCP","93","[TCP Spurious Retransmission] 20  >  9999 [SYN] Seq=0 Win=8192 Len=39"
"143","0.228325923","192.168.60.70","192.168.60.233","TCP","54","9999  >  20 [RST, ACK] Seq=1 Ack=40 Win=0 Len=0"
"144","0.231275505","192.168.60.233","192.168.60.70","TCP","93","[TCP Spurious Retransmission] 20  >  9999 [SYN] Seq=0 Win=8192 Len=39"
"145","0.231321636","192.168.60.70","192.168.60.233","TCP","54","9999  >  20 [RST, ACK] Seq=1 Ack=40 Win=0 Len=0"
"146","0.233296595","192.168.60.233","192.168.60.70","TCP","93","[TCP Spurious Retransmission] 20  >  9999 [SYN] Seq=0 Win=8192 Len=39"
"147","0.233341761","192.168.60.70","192.168.60.233","TCP","54","9999  >  20 [RST, ACK] Seq=1 Ack=40 Win=0 Len=0"
"148","0.237560753","192.168.60.233","192.168.60.70","TCP","93","[TCP Spurious Retransmission] 20  >  9999 [SYN] Seq=0 Win=8192 Len=39"
"149","0.237608910","192.168.60.70","192.168.60.233","TCP","54","9999  >  20 [RST, ACK] Seq=1 Ack=40 Win=0 Len=0"
"150","0.238719122","192.168.60.233","192.168.60.70","TCP","93","[TCP Spurious Retransmission] 20  >  9999 [SYN] Seq=0 Win=8192 Len=39"
"151","0.238755825","192.168.60.70","192.168.60.233","TCP","54","9999  >  20 [RST, ACK] Seq=1 Ack=40 Win=0 Len=0"
"152","0.240811526","192.168.60.233","192.168.60.70","TCP","93","[TCP Spurious Retransmission] 20  >  9999 [SYN] Seq=0 Win=8192 Len=39"
"153","0.240855188","192.168.60.70","192.168.60.233","TCP","54","9999  >  20 [RST, ACK] Seq=1 Ack=40 Win=0 Len=0"
"154","0.243207381","192.168.60.233","192.168.60.70","TCP","93","[TCP Spurious Retransmission] 20  >  9999 [SYN] Seq=0 Win=8192 Len=39"
"155","0.243259149","192.168.60.70","192.168.60.233","TCP","54","9999  >  20 [RST, ACK] Seq=1 Ack=40 Win=0 Len=0"
"156","0.245681936","192.168.60.233","192.168.60.70","TCP","93","[TCP Spurious Retransmission] 20  >  9999 [SYN] Seq=0 Win=8192 Len=39"
"157","0.245726077","192.168.60.70","192.168.60.233","TCP","54","9999  >  20 [RST, ACK] Seq=1 Ack=40 Win=0 Len=0"
"158","0.248297838","192.168.60.233","192.168.60.70","TCP","93","[TCP Spurious Retransmission] 20  >  9999 [SYN] Seq=0 Win=8192 Len=39"
"159","0.248342079","192.168.60.70","192.168.60.233","TCP","54","9999  >  20 [RST, ACK] Seq=1 Ack=40 Win=0 Len=0"
"160","0.250404463","192.168.60.233","192.168.60.70","TCP","93","[TCP Spurious Retransmission] 20  >  9999 [SYN] Seq=0 Win=8192 Len=39"
"161","0.250469241","192.168.60.70","192.168.60.233","TCP","54","9999  >  20 [RST, ACK] Seq=1 Ack=40 Win=0 Len=0"
"162","0.252935464","192.168.60.233","192.168.60.70","TCP","93","[TCP Spurious Retransmission] 20  >  9999 [SYN] Seq=0 Win=8192 Len=39"
"163","0.252983316","192.168.60.70","192.168.60.233","TCP","54","9999  >  20 [RST, ACK] Seq=1 Ack=40 Win=0 Len=0"
"164","0.255451802","192.168.60.233","192.168.60.70","TCP","93","[TCP Spurious Retransmission] 20  >  9999 [SYN] Seq=0 Win=8192 Len=39"
"165","0.255495784","192.168.60.70","192.168.60.233","TCP","54","9999  >  20 [RST, ACK] Seq=1 Ack=40 Win=0 Len=0"
"166","0.258027901","192.168.60.233","192.168.60.70","TCP","93","[TCP Spurious Retransmission] 20  >  9999 [SYN] Seq=0 Win=8192 Len=39"
"167","0.258099757","192.168.60.70","192.168.60.233","TCP","54","9999  >  20 [RST, ACK] Seq=1 Ack=40 Win=0 Len=0"
"168","0.260347215","192.168.60.233","192.168.60.70","TCP","93","[TCP Spurious Retransmission] 20  >  9999 [SYN] Seq=0 Win=8192 Len=39"
"169","0.260486089","192.168.60.70","192.168.60.233","TCP","54","9999  >  20 [RST, ACK] Seq=1 Ack=40 Win=0 Len=0"
"170","0.268469537","192.168.60.233","192.168.60.70","TCP","93","[TCP Spurious Retransmission] 20  >  9999 [SYN] Seq=0 Win=8192 Len=39"
"171","0.268505116","192.168.60.70","192.168.60.233","TCP","54","9999  >  20 [RST, ACK] Seq=1 Ack=40 Win=0 Len=0"
"172","0.268719466","192.168.60.233","192.168.60.70","TCP","93","[TCP Spurious Retransmission] 20  >  9999 [SYN] Seq=0 Win=8192 Len=39"
"173","0.268734018","192.168.60.70","192.168.60.233","TCP","54","9999  >  20 [RST, ACK] Seq=1 Ack=40 Win=0 Len=0"
"174","0.268926556","192.168.60.233","192.168.60.70","TCP","93","[TCP Spurious Retransmission] 20  >  9999 [SYN] Seq=0 Win=8192 Len=39"
"175","0.268941667","192.168.60.70","192.168.60.233","TCP","54","9999  >  20 [RST, ACK] Seq=1 Ack=40 Win=0 Len=0"
"176","0.270440625","192.168.60.233","192.168.60.70","TCP","93","[TCP Spurious Retransmission] 20  >  9999 [SYN] Seq=0 Win=8192 Len=39"
"177","0.270500520","192.168.60.70","192.168.60.233","TCP","54","9999  >  20 [RST, ACK] Seq=1 Ack=40 Win=0 Len=0"
"178","0.271836281","192.168.60.233","192.168.60.70","TCP","93","[TCP Spurious Retransmission] 20  >  9999 [SYN] Seq=0 Win=8192 Len=39"
"179","0.271896248","192.168.60.70","192.168.60.233","TCP","54","9999  >  20 [RST, ACK] Seq=1 Ack=40 Win=0 Len=0"
"180","0.274966911","192.168.60.233","192.168.60.70","TCP","93","[TCP Spurious Retransmission] 20  >  9999 [SYN] Seq=0 Win=8192 Len=39"
"181","0.275006080","192.168.60.70","192.168.60.233","TCP","54","9999  >  20 [RST, ACK] Seq=1 Ack=40 Win=0 Len=0"
"182","0.277091122","192.168.60.233","192.168.60.70","TCP","93","[TCP Spurious Retransmission] 20  >  9999 [SYN] Seq=0 Win=8192 Len=39"
"183","0.277119946","192.168.60.70","192.168.60.233","TCP","54","9999  >  20 [RST, ACK] Seq=1 Ack=40 Win=0 Len=0"
"184","0.279261837","192.168.60.233","192.168.60.70","TCP","93","[TCP Spurious Retransmission] 20  >  9999 [SYN] Seq=0 Win=8192 Len=39"
"185","0.279314093","192.168.60.70","192.168.60.233","TCP","54","9999  >  20 [RST, ACK] Seq=1 Ack=40 Win=0 Len=0"
"186","0.282544197","192.168.60.233","192.168.60.70","TCP","93","[TCP Spurious Retransmission] 20  >  9999 [SYN] Seq=0 Win=8192 Len=39"
"187","0.282629246","192.168.60.70","192.168.60.233","TCP","54","9999  >  20 [RST, ACK] Seq=1 Ack=40 Win=0 Len=0"
"188","0.283971870","192.168.60.233","192.168.60.70","TCP","93","[TCP Spurious Retransmission] 20  >  9999 [SYN] Seq=0 Win=8192 Len=39"
"189","0.284091388","192.168.60.70","192.168.60.233","TCP","54","9999  >  20 [RST, ACK] Seq=1 Ack=40 Win=0 Len=0"
"190","0.286867469","192.168.60.233","192.168.60.70","TCP","93","[TCP Spurious Retransmission] 20  >  9999 [SYN] Seq=0 Win=8192 Len=39"
"191","0.286895654","192.168.60.70","192.168.60.233","TCP","54","9999  >  20 [RST, ACK] Seq=1 Ack=40 Win=0 Len=0"
"192","0.289931703","192.168.60.233","192.168.60.70","TCP","93","[TCP Spurious Retransmission] 20  >  9999 [SYN] Seq=0 Win=8192 Len=39"
"193","0.289959692","192.168.60.70","192.168.60.233","TCP","54","9999  >  20 [RST, ACK] Seq=1 Ack=40 Win=0 Len=0"
"194","0.291939047","192.168.60.233","192.168.60.70","TCP","93","[TCP Spurious Retransmission] 20  >  9999 [SYN] Seq=0 Win=8192 Len=39"
"195","0.291954249","192.168.60.70","192.168.60.233","TCP","54","9999  >  20 [RST, ACK] Seq=1 Ack=40 Win=0 Len=0"
"196","0.294450738","192.168.60.233","192.168.60.70","TCP","93","[TCP Spurious Retransmission] 20  >  9999 [SYN] Seq=0 Win=8192 Len=39"
"197","0.294500652","192.168.60.70","192.168.60.233","TCP","54","9999  >  20 [RST, ACK] Seq=1 Ack=40 Win=0 Len=0"
"198","0.297025648","192.168.60.233","192.168.60.70","TCP","93","[TCP Spurious Retransmission] 20  >  9999 [SYN] Seq=0 Win=8192 Len=39"
"199","0.297064623","192.168.60.70","192.168.60.233","TCP","54","9999  >  20 [RST, ACK] Seq=1 Ack=40 Win=0 Len=0"
"200","0.299419295","192.168.60.233","192.168.60.70","TCP","93","[TCP Spurious Retransmission] 20  >  9999 [SYN] Seq=0 Win=8192 Len=39"
"201","0.299437003","192.168.60.70","192.168.60.233","TCP","54","9999  >  20 [RST, ACK] Seq=1 Ack=40 Win=0 Len=0"
"202","0.302053035","192.168.60.233","192.168.60.70","TCP","93","[TCP Spurious Retransmission] 20  >  9999 [SYN] Seq=0 Win=8192 Len=39"
"203","0.302073557","192.168.60.70","192.168.60.233","TCP","54","9999  >  20 [RST, ACK] Seq=1 Ack=40 Win=0 Len=0"
"204","0.304450351","192.168.60.233","192.168.60.70","TCP","93","[TCP Spurious Retransmission] 20  >  9999 [SYN] Seq=0 Win=8192 Len=39"
"205","0.304473242","192.168.60.70","192.168.60.233","TCP","54","9999  >  20 [RST, ACK] Seq=1 Ack=40 Win=0 Len=0"
"206","0.305673304","203.23.178.29","192.168.60.70","TCP","66","443  >  40556 [ACK] Seq=1 Ack=1 Win=11 Len=0 TSval=3460949677 TSecr=311735782"
"207","0.305693499","192.168.60.70","203.23.178.29","TCP","66","[TCP ACKed unseen segment] 40556  >  443 [ACK] Seq=1 Ack=2 Win=501 Len=0 TSval=311746017 TSecr=3460944794"
"208","0.315456830","192.168.60.233","192.168.60.70","TCP","93","[TCP Spurious Retransmission] 20  >  9999 [SYN] Seq=0 Win=8192 Len=39"
"209","0.315481094","192.168.60.70","192.168.60.233","TCP","54","9999  >  20 [RST, ACK] Seq=1 Ack=40 Win=0 Len=0"
"210","0.315685354","192.168.60.233","192.168.60.70","TCP","93","[TCP Spurious Retransmission] 20  >  9999 [SYN] Seq=0 Win=8192 Len=39"
"211","0.315694530","192.168.60.70","192.168.60.233","TCP","54","9999  >  20 [RST, ACK] Seq=1 Ack=40 Win=0 Len=0"
"212","0.315937506","192.168.60.233","192.168.60.70","TCP","93","[TCP Spurious Retransmission] 20  >  9999 [SYN] Seq=0 Win=8192 Len=39"
"213","0.315946037","192.168.60.70","192.168.60.233","TCP","54","9999  >  20 [RST, ACK] Seq=1 Ack=40 Win=0 Len=0"
"214","0.316163163","192.168.60.233","192.168.60.70","TCP","93","[TCP Spurious Retransmission] 20  >  9999 [SYN] Seq=0 Win=8192 Len=39"
"215","0.316172464","192.168.60.70","192.168.60.233","TCP","54","9999  >  20 [RST, ACK] Seq=1 Ack=40 Win=0 Len=0"
"216","0.317570204","192.168.60.233","192.168.60.70","TCP","93","[TCP Spurious Retransmission] 20  >  9999 [SYN] Seq=0 Win=8192 Len=39"
"217","0.317583920","192.168.60.70","192.168.60.233","TCP","54","9999  >  20 [RST, ACK] Seq=1 Ack=40 Win=0 Len=0"
"218","0.320311533","192.168.60.233","192.168.60.70","TCP","93","[TCP Spurious Retransmission] 20  >  9999 [SYN] Seq=0 Win=8192 Len=39"
"219","0.320333701","192.168.60.70","192.168.60.233","TCP","54","9999  >  20 [RST, ACK] Seq=1 Ack=40 Win=0 Len=0"
"220","0.323179051","192.168.60.233","192.168.60.70","TCP","93","[TCP Spurious Retransmission] 20  >  9999 [SYN] Seq=0 Win=8192 Len=39"
"221","0.323204348","192.168.60.70","192.168.60.233","TCP","54","9999  >  20 [RST, ACK] Seq=1 Ack=40 Win=0 Len=0"
"222","0.324186373","192.168.60.233","192.168.60.70","TCP","93","[TCP Spurious Retransmission] 20  >  9999 [SYN] Seq=0 Win=8192 Len=39"
"223","0.324200674","192.168.60.70","192.168.60.233","TCP","54","9999  >  20 [RST, ACK] Seq=1 Ack=40 Win=0 Len=0"
"224","0.326579969","192.168.60.233","192.168.60.70","TCP","93","[TCP Spurious Retransmission] 20  >  9999 [SYN] Seq=0 Win=8192 Len=39"
"225","0.326601244","192.168.60.70","192.168.60.233","TCP","54","9999  >  20 [RST, ACK] Seq=1 Ack=40 Win=0 Len=0"
"226","0.328782151","192.168.60.233","192.168.60.70","TCP","93","[TCP Spurious Retransmission] 20  >  9999 [SYN] Seq=0 Win=8192 Len=39"
"227","0.328812172","192.168.60.70","192.168.60.233","TCP","54","9999  >  20 [RST, ACK] Seq=1 Ack=40 Win=0 Len=0"
"228","0.331532037","192.168.60.233","192.168.60.70","TCP","93","[TCP Spurious Retransmission] 20  >  9999 [SYN] Seq=0 Win=8192 Len=39"
"229","0.331555480","192.168.60.70","192.168.60.233","TCP","54","9999  >  20 [RST, ACK] Seq=1 Ack=40 Win=0 Len=0"
"230","0.333900118","192.168.60.233","192.168.60.70","TCP","93","[TCP Spurious Retransmission] 20  >  9999 [SYN] Seq=0 Win=8192 Len=39"
"231","0.333926569","192.168.60.70","192.168.60.233","TCP","54","9999  >  20 [RST, ACK] Seq=1 Ack=40 Win=0 Len=0"
"232","0.336703797","192.168.60.233","192.168.60.70","TCP","93","[TCP Spurious Retransmission] 20  >  9999 [SYN] Seq=0 Win=8192 Len=39"
"233","0.336736395","192.168.60.70","192.168.60.233","TCP","54","9999  >  20 [RST, ACK] Seq=1 Ack=40 Win=0 Len=0"
"234","0.339209506","192.168.60.233","192.168.60.70","TCP","93","[TCP Spurious Retransmission] 20  >  9999 [SYN] Seq=0 Win=8192 Len=39"
"235","0.339241977","192.168.60.70","192.168.60.233","TCP","54","9999  >  20 [RST, ACK] Seq=1 Ack=40 Win=0 Len=0"
"236","0.341753561","192.168.60.233","192.168.60.70","TCP","93","[TCP Spurious Retransmission] 20  >  9999 [SYN] Seq=0 Win=8192 Len=39"
"237","0.341780083","192.168.60.70","192.168.60.233","TCP","54","9999  >  20 [RST, ACK] Seq=1 Ack=40 Win=0 Len=0"
"238","0.343918150","192.168.60.233","192.168.60.70","TCP","93","[TCP Spurious Retransmission] 20  >  9999 [SYN] Seq=0 Win=8192 Len=39"
"239","0.343948105","192.168.60.70","192.168.60.233","TCP","54","9999  >  20 [RST, ACK] Seq=1 Ack=40 Win=0 Len=0"
"240","0.346788507","192.168.60.233","192.168.60.70","TCP","93","[TCP Spurious Retransmission] 20  >  9999 [SYN] Seq=0 Win=8192 Len=39"
"241","0.346814990","192.168.60.70","192.168.60.233","TCP","54","9999  >  20 [RST, ACK] Seq=1 Ack=40 Win=0 Len=0"
"242","0.349100040","192.168.60.233","192.168.60.70","TCP","93","[TCP Spurious Retransmission] 20  >  9999 [SYN] Seq=0 Win=8192 Len=39"
"243","0.349128121","192.168.60.70","192.168.60.233","TCP","54","9999  >  20 [RST, ACK] Seq=1 Ack=40 Win=0 Len=0"
"244","0.351287414","192.168.60.233","192.168.60.70","TCP","93","[TCP Spurious Retransmission] 20  >  9999 [SYN] Seq=0 Win=8192 Len=39"
"245","0.351309125","192.168.60.70","192.168.60.233","TCP","54","9999  >  20 [RST, ACK] Seq=1 Ack=40 Win=0 Len=0"
"246","0.354299519","192.168.60.233","192.168.60.70","TCP","93","[TCP Spurious Retransmission] 20  >  9999 [SYN] Seq=0 Win=8192 Len=39"
"247","0.354330978","192.168.60.70","192.168.60.233","TCP","54","9999  >  20 [RST, ACK] Seq=1 Ack=40 Win=0 Len=0"
"248","0.356770227","192.168.60.233","192.168.60.70","TCP","93","[TCP Spurious Retransmission] 20  >  9999 [SYN] Seq=0 Win=8192 Len=39"
"249","0.356816868","192.168.60.70","192.168.60.233","TCP","54","9999  >  20 [RST, ACK] Seq=1 Ack=40 Win=0 Len=0"
"250","0.359029505","192.168.60.233","192.168.60.70","TCP","93","[TCP Spurious Retransmission] 20  >  9999 [SYN] Seq=0 Win=8192 Len=39"
"251","0.359052412","192.168.60.70","192.168.60.233","TCP","54","9999  >  20 [RST, ACK] Seq=1 Ack=40 Win=0 Len=0"
"252","0.364274530","192.168.60.233","192.168.60.70","TCP","93","[TCP Spurious Retransmission] 20  >  9999 [SYN] Seq=0 Win=8192 Len=39"
"253","0.364297591","192.168.60.70","192.168.60.233","TCP","54","9999  >  20 [RST, ACK] Seq=1 Ack=40 Win=0 Len=0"
"254","0.364430914","192.168.60.233","192.168.60.70","TCP","93","[TCP Spurious Retransmission] 20  >  9999 [SYN] Seq=0 Win=8192 Len=39"
"255","0.364439637","192.168.60.70","192.168.60.233","TCP","54","9999  >  20 [RST, ACK] Seq=1 Ack=40 Win=0 Len=0"
"256","0.366067703","192.168.60.233","192.168.60.70","TCP","93","[TCP Spurious Retransmission] 20  >  9999 [SYN] Seq=0 Win=8192 Len=39"
"257","0.366088198","192.168.60.70","192.168.60.233","TCP","54","9999  >  20 [RST, ACK] Seq=1 Ack=40 Win=0 Len=0"
"258","0.368440271","192.168.60.233","192.168.60.70","TCP","93","[TCP Spurious Retransmission] 20  >  9999 [SYN] Seq=0 Win=8192 Len=39"
"259","0.368450451","192.168.60.70","192.168.60.233","TCP","54","9999  >  20 [RST, ACK] Seq=1 Ack=40 Win=0 Len=0"
"260","0.370713451","192.168.60.233","192.168.60.70","TCP","93","[TCP Spurious Retransmission] 20  >  9999 [SYN] Seq=0 Win=8192 Len=39"
"261","0.370736558","192.168.60.70","192.168.60.233","TCP","54","9999  >  20 [RST, ACK] Seq=1 Ack=40 Win=0 Len=0"
"262","0.373436997","192.168.60.233","192.168.60.70","TCP","93","[TCP Spurious Retransmission] 20  >  9999 [SYN] Seq=0 Win=8192 Len=39"
"263","0.373492211","192.168.60.70","192.168.60.233","TCP","54","9999  >  20 [RST, ACK] Seq=1 Ack=40 Win=0 Len=0"
"264","0.375871561","192.168.60.233","192.168.60.70","TCP","93","[TCP Spurious Retransmission] 20  >  9999 [SYN] Seq=0 Win=8192 Len=39"
"265","0.375883728","192.168.60.70","192.168.60.233","TCP","54","9999  >  20 [RST, ACK] Seq=1 Ack=40 Win=0 Len=0"
"266","0.378482153","192.168.60.233","192.168.60.70","TCP","93","[TCP Spurious Retransmission] 20  >  9999 [SYN] Seq=0 Win=8192 Len=39"
"267","0.378510301","192.168.60.70","192.168.60.233","TCP","54","9999  >  20 [RST, ACK] Seq=1 Ack=40 Win=0 Len=0"
"268","0.390749657","192.168.60.233","192.168.60.70","TCP","93","[TCP Spurious Retransmission] 20  >  9999 [SYN] Seq=0 Win=8192 Len=39"
"269","0.390789758","192.168.60.70","192.168.60.233","TCP","54","9999  >  20 [RST, ACK] Seq=1 Ack=40 Win=0 Len=0"
"270","0.390913347","192.168.60.233","192.168.60.70","TCP","93","[TCP Spurious Retransmission] 20  >  9999 [SYN] Seq=0 Win=8192 Len=39"
"271","0.390926891","192.168.60.70","192.168.60.233","TCP","54","9999  >  20 [RST, ACK] Seq=1 Ack=40 Win=0 Len=0"
"272","0.391120128","192.168.60.233","192.168.60.70","TCP","93","[TCP Spurious Retransmission] 20  >  9999 [SYN] Seq=0 Win=8192 Len=39"
"273","0.391145875","192.168.60.70","192.168.60.233","TCP","54","9999  >  20 [RST, ACK] Seq=1 Ack=40 Win=0 Len=0"
"274","0.392091251","192.168.60.233","192.168.60.70","TCP","93","[TCP Spurious Retransmission] 20  >  9999 [SYN] Seq=0 Win=8192 Len=39"
"275","0.392114638","192.168.60.70","192.168.60.233","TCP","54","9999  >  20 [RST, ACK] Seq=1 Ack=40 Win=0 Len=0"
"276","0.392654760","192.168.60.233","192.168.60.70","TCP","93","[TCP Spurious Retransmission] 20  >  9999 [SYN] Seq=0 Win=8192 Len=39"
"277","0.392677725","192.168.60.70","192.168.60.233","TCP","54","9999  >  20 [RST, ACK] Seq=1 Ack=40 Win=0 Len=0"
"278","0.402920352","192.168.60.233","192.168.60.70","TCP","93","[TCP Spurious Retransmission] 20  >  9999 [SYN] Seq=0 Win=8192 Len=39"
"279","0.402960021","192.168.60.70","192.168.60.233","TCP","54","9999  >  20 [RST, ACK] Seq=1 Ack=40 Win=0 Len=0"
"280","0.403081064","192.168.60.233","192.168.60.70","TCP","93","[TCP Spurious Retransmission] 20  >  9999 [SYN] Seq=0 Win=8192 Len=39"
"281","0.403094170","192.168.60.70","192.168.60.233","TCP","54","9999  >  20 [RST, ACK] Seq=1 Ack=40 Win=0 Len=0"
"282","0.403842320","192.168.60.233","192.168.60.70","TCP","93","[TCP Spurious Retransmission] 20  >  9999 [SYN] Seq=0 Win=8192 Len=39"
"283","0.403860373","192.168.60.70","192.168.60.233","TCP","54","9999  >  20 [RST, ACK] Seq=1 Ack=40 Win=0 Len=0"
"284","0.404532935","192.168.60.233","192.168.60.70","TCP","93","[TCP Spurious Retransmission] 20  >  9999 [SYN] Seq=0 Win=8192 Len=39"
"285","0.404557897","192.168.60.70","192.168.60.233","TCP","54","9999  >  20 [RST, ACK] Seq=1 Ack=40 Win=0 Len=0"
"286","0.404748702","192.168.60.233","192.168.60.70","TCP","93","[TCP Spurious Retransmission] 20  >  9999 [SYN] Seq=0 Win=8192 Len=39"
"287","0.404764696","192.168.60.70","192.168.60.233","TCP","54","9999  >  20 [RST, ACK] Seq=1 Ack=40 Win=0 Len=0"
"288","0.405610363","192.168.60.233","192.168.60.70","TCP","93","[TCP Spurious Retransmission] 20  >  9999 [SYN] Seq=0 Win=8192 Len=39"
"289","0.405632992","192.168.60.70","192.168.60.233","TCP","54","9999  >  20 [RST, ACK] Seq=1 Ack=40 Win=0 Len=0"
"290","0.407293553","192.168.60.233","192.168.60.70","TCP","93","[TCP Spurious Retransmission] 20  >  9999 [SYN] Seq=0 Win=8192 Len=39"
"291","0.407327517","192.168.60.70","192.168.60.233","TCP","54","9999  >  20 [RST, ACK] Seq=1 Ack=40 Win=0 Len=0"
"292","0.420820609","192.168.60.233","192.168.60.70","TCP","93","[TCP Spurious Retransmission] 20  >  9999 [SYN] Seq=0 Win=8192 Len=39"
"293","0.420861115","192.168.60.70","192.168.60.233","TCP","54","9999  >  20 [RST, ACK] Seq=1 Ack=40 Win=0 Len=0"
"294","0.421034603","192.168.60.233","192.168.60.70","TCP","93","[TCP Spurious Retransmission] 20  >  9999 [SYN] Seq=0 Win=8192 Len=39"
"295","0.421054184","192.168.60.70","192.168.60.233","TCP","54","9999  >  20 [RST, ACK] Seq=1 Ack=40 Win=0 Len=0"
"296","0.421440767","192.168.60.233","192.168.60.70","TCP","93","[TCP Spurious Retransmission] 20  >  9999 [SYN] Seq=0 Win=8192 Len=39"
"297","0.421453346","192.168.60.70","192.168.60.233","TCP","54","9999  >  20 [RST, ACK] Seq=1 Ack=40 Win=0 Len=0"
"298","0.422276097","192.168.60.233","192.168.60.70","TCP","93","[TCP Spurious Retransmission] 20  >  9999 [SYN] Seq=0 Win=8192 Len=39"
"299","0.422293370","192.168.60.70","192.168.60.233","TCP","54","9999  >  20 [RST, ACK] Seq=1 Ack=40 Win=0 Len=0"
"300","0.422518819","192.168.60.233","192.168.60.70","TCP","93","[TCP Spurious Retransmission] 20  >  9999 [SYN] Seq=0 Win=8192 Len=39"
"301","0.422528480","192.168.60.70","192.168.60.233","TCP","54","9999  >  20 [RST, ACK] Seq=1 Ack=40 Win=0 Len=0"
"302","0.423253640","192.168.60.233","192.168.60.70","TCP","93","[TCP Spurious Retransmission] 20  >  9999 [SYN] Seq=0 Win=8192 Len=39"
"303","0.423262159","192.168.60.70","192.168.60.233","TCP","54","9999  >  20 [RST, ACK] Seq=1 Ack=40 Win=0 Len=0"
"304","0.424236821","192.168.60.233","192.168.60.70","TCP","93","[TCP Spurious Retransmission] 20  >  9999 [SYN] Seq=0 Win=8192 Len=39"
"305","0.424262725","192.168.60.70","192.168.60.233","TCP","54","9999  >  20 [RST, ACK] Seq=1 Ack=40 Win=0 Len=0"
"306","0.427056914","192.168.60.233","192.168.60.70","TCP","93","[TCP Spurious Retransmission] 20  >  9999 [SYN] Seq=0 Win=8192 Len=39"
"307","0.427093037","192.168.60.70","192.168.60.233","TCP","54","9999  >  20 [RST, ACK] Seq=1 Ack=40 Win=0 Len=0"
"308","0.429371354","192.168.60.233","192.168.60.70","TCP","93","[TCP Spurious Retransmission] 20  >  9999 [SYN] Seq=0 Win=8192 Len=39"
"309","0.429404957","192.168.60.70","192.168.60.233","TCP","54","9999  >  20 [RST, ACK] Seq=1 Ack=40 Win=0 Len=0"
"310","0.431758823","192.168.60.233","192.168.60.70","TCP","93","[TCP Spurious Retransmission] 20  >  9999 [SYN] Seq=0 Win=8192 Len=39"
"311","0.431783589","192.168.60.70","192.168.60.233","TCP","54","9999  >  20 [RST, ACK] Seq=1 Ack=40 Win=0 Len=0"
"312","0.434197651","192.168.60.233","192.168.60.70","TCP","93","[TCP Spurious Retransmission] 20  >  9999 [SYN] Seq=0 Win=8192 Len=39"
"313","0.434225858","192.168.60.70","192.168.60.233","TCP","54","9999  >  20 [RST, ACK] Seq=1 Ack=40 Win=0 Len=0"
"314","0.436688692","192.168.60.233","192.168.60.70","TCP","93","[TCP Spurious Retransmission] 20  >  9999 [SYN] Seq=0 Win=8192 Len=39"
"315","0.436720120","192.168.60.70","192.168.60.233","TCP","54","9999  >  20 [RST, ACK] Seq=1 Ack=40 Win=0 Len=0"
"316","0.439220888","192.168.60.233","192.168.60.70","TCP","93","[TCP Spurious Retransmission] 20  >  9999 [SYN] Seq=0 Win=8192 Len=39"
"317","0.439239648","192.168.60.70","192.168.60.233","TCP","54","9999  >  20 [RST, ACK] Seq=1 Ack=40 Win=0 Len=0"
"318","0.441578167","192.168.60.233","192.168.60.70","TCP","93","[TCP Spurious Retransmission] 20  >  9999 [SYN] Seq=0 Win=8192 Len=39"
"319","0.441606421","192.168.60.70","192.168.60.233","TCP","54","9999  >  20 [RST, ACK] Seq=1 Ack=40 Win=0 Len=0"
