"No.","Time","Source","Destination","Protocol","Length","Info"
"1","0.000000000","2409:40e0:51:30ac:48df:8997:7dcc:b2e2","2405:200:1606:1716::f","TLSv1.2","110","Application Data"
"2","0.000081151","2409:40e0:51:30ac:48df:8997:7dcc:b2e2","2405:200:1606:1716::f","TCP","86","46030  >  443 [FIN, ACK] Seq=25 Ack=1 Win=4173 Len=0 TSval=325677959 TSecr=3430507959"
"3","0.031069367","2405:200:1606:1716::f","2409:40e0:51:30ac:48df:8997:7dcc:b2e2","TCP","86","443  >  46030 [FIN, ACK] Seq=1 Ack=25 Win=291 Len=0 TSval=3430510779 TSecr=325677959"
"4","0.031120570","2409:40e0:51:30ac:48df:8997:7dcc:b2e2","2405:200:1606:1716::f","TCP","86","46030  >  443 [ACK] Seq=26 Ack=2 Win=4173 Len=0 TSval=325677990 TSecr=3430510779"
"5","0.033295108","2405:200:1606:1716::f","2409:40e0:51:30ac:48df:8997:7dcc:b2e2","TCP","86","443  >  46030 [ACK] Seq=2 Ack=26 Win=291 Len=0 TSval=3430510784 TSecr=325677959"
"6","0.780863031","Apple_f2:ed:3a","Broadcast","ARP","42","Who has 192.168.60.70? Tell 192.168.60.233"
"7","0.780888628","Shenzhen_34:c4:a5","Apple_f2:ed:3a","ARP","42","192.168.60.70 is at 1c:bf:ce:34:c4:a5"
"8","0.791196451","192.168.60.233","192.168.60.70","TCP","54","20  >  80 [SYN] Seq=0 Win=8192 Len=0"
"9","0.791247223","192.168.60.70","192.168.60.233","TCP","54","80  >  20 [RST, ACK] Seq=1 Ack=1 Win=0 Len=0"
"10","0.796196184","192.168.60.233","192.168.60.70","TCP","54","[TCP Retransmission] 20  >  80 [SYN] Seq=0 Win=8192 Len=0"
"11","0.796240613","192.168.60.70","192.168.60.233","TCP","54","80  >  20 [RST, ACK] Seq=1 Ack=1 Win=0 Len=0"
"12","0.801710329","192.168.60.233","192.168.60.70","TCP","54","[TCP Retransmission] 20  >  80 [SYN] Seq=0 Win=8192 Len=0"
"13","0.801756797","192.168.60.70","192.168.60.233","TCP","54","80  >  20 [RST, ACK] Seq=1 Ack=1 Win=0 Len=0"
"14","0.805075858","192.168.60.233","192.168.60.70","TCP","54","[TCP Retransmission] 20  >  80 [SYN] Seq=0 Win=8192 Len=0"
"15","0.805120267","192.168.60.70","192.168.60.233","TCP","54","80  >  20 [RST, ACK] Seq=1 Ack=1 Win=0 Len=0"
"16","0.808881354","192.168.60.233","192.168.60.70","TCP","54","[TCP Retransmission] 20  >  80 [SYN] Seq=0 Win=8192 Len=0"
"17","0.808941987","192.168.60.70","192.168.60.233","TCP","54","80  >  20 [RST, ACK] Seq=1 Ack=1 Win=0 Len=0"
"18","0.812801623","192.168.60.233","192.168.60.70","TCP","54","[TCP Retransmission] 20  >  80 [SYN] Seq=0 Win=8192 Len=0"
"19","0.812837540","192.168.60.70","192.168.60.233","TCP","54","80  >  20 [RST, ACK] Seq=1 Ack=1 Win=0 Len=0"
"20","0.815853914","192.168.60.233","192.168.60.70","TCP","54","[TCP Retransmission] 20  >  80 [SYN] Seq=0 Win=8192 Len=0"
"21","0.815889928","192.168.60.70","192.168.60.233","TCP","54","80  >  20 [RST, ACK] Seq=1 Ack=1 Win=0 Len=0"
"22","0.818214687","192.168.60.233","192.168.60.70","TCP","54","[TCP Retransmission] 20  >  80 [SYN] Seq=0 Win=8192 Len=0"
"23","0.818258673","192.168.60.70","192.168.60.233","TCP","54","80  >  20 [RST, ACK] Seq=1 Ack=1 Win=0 Len=0"
"24","0.820940671","192.168.60.233","192.168.60.70","TCP","54","[TCP Retransmission] 20  >  80 [SYN] Seq=0 Win=8192 Len=0"
"25","0.820985157","192.168.60.70","192.168.60.233","TCP","54","80  >  20 [RST, ACK] Seq=1 Ack=1 Win=0 Len=0"
"26","0.824304862","192.168.60.233","192.168.60.70","TCP","54","[TCP Retransmission] 20  >  80 [SYN] Seq=0 Win=8192 Len=0"
"27","0.824319671","192.168.60.70","192.168.60.233","TCP","54","80  >  20 [RST, ACK] Seq=1 Ack=1 Win=0 Len=0"
"28","0.834039734","192.168.60.233","192.168.60.70","TCP","54","[TCP Retransmission] 20  >  80 [SYN] Seq=0 Win=8192 Len=0"
"29","0.834087514","192.168.60.70","192.168.60.233","TCP","54","80  >  20 [RST, ACK] Seq=1 Ack=1 Win=0 Len=0"
"30","0.834686287","192.168.60.233","192.168.60.70","TCP","54","[TCP Retransmission] 20  >  80 [SYN] Seq=0 Win=8192 Len=0"
"31","0.834718976","192.168.60.70","192.168.60.233","TCP","54","80  >  20 [RST, ACK] Seq=1 Ack=1 Win=0 Len=0"
"32","0.834792932","192.168.60.233","192.168.60.70","TCP","54","[TCP Retransmission] 20  >  80 [SYN] Seq=0 Win=8192 Len=0"
"33","0.834805489","192.168.60.70","192.168.60.233","TCP","54","80  >  20 [RST, ACK] Seq=1 Ack=1 Win=0 Len=0"
"34","0.835200273","192.168.60.233","192.168.60.70","TCP","54","[TCP Retransmission] 20  >  80 [SYN] Seq=0 Win=8192 Len=0"
"35","0.835226441","192.168.60.70","192.168.60.233","TCP","54","80  >  20 [RST, ACK] Seq=1 Ack=1 Win=0 Len=0"
"36","0.837783981","192.168.60.233","192.168.60.70","TCP","54","[TCP Retransmission] 20  >  80 [SYN] Seq=0 Win=8192 Len=0"
"37","0.837811159","192.168.60.70","192.168.60.233","TCP","54","80  >  20 [RST, ACK] Seq=1 Ack=1 Win=0 Len=0"
"38","0.840634613","192.168.60.233","192.168.60.70","TCP","54","[TCP Retransmission] 20  >  80 [SYN] Seq=0 Win=8192 Len=0"
"39","0.840681679","192.168.60.70","192.168.60.233","TCP","54","80  >  20 [RST, ACK] Seq=1 Ack=1 Win=0 Len=0"
"40","0.843491628","192.168.60.233","192.168.60.70","TCP","54","[TCP Retransmission] 20  >  80 [SYN] Seq=0 Win=8192 Len=0"
"41","0.843537277","192.168.60.70","192.168.60.233","TCP","54","80  >  20 [RST, ACK] Seq=1 Ack=1 Win=0 Len=0"
"42","0.845967798","192.168.60.233","192.168.60.70","TCP","54","[TCP Retransmission] 20  >  80 [SYN] Seq=0 Win=8192 Len=0"
"43","0.846044241","192.168.60.70","192.168.60.233","TCP","54","80  >  20 [RST, ACK] Seq=1 Ack=1 Win=0 Len=0"
"44","0.849823904","192.168.60.233","192.168.60.70","TCP","54","[TCP Retransmission] 20  >  80 [SYN] Seq=0 Win=8192 Len=0"
"45","0.849856163","192.168.60.70","192.168.60.233","TCP","54","80  >  20 [RST, ACK] Seq=1 Ack=1 Win=0 Len=0"
"46","0.853192942","192.168.60.233","192.168.60.70","TCP","54","[TCP Retransmission] 20  >  80 [SYN] Seq=0 Win=8192 Len=0"
"47","0.853218927","192.168.60.70","192.168.60.233","TCP","54","80  >  20 [RST, ACK] Seq=1 Ack=1 Win=0 Len=0"
"48","0.853320391","192.168.60.233","192.168.60.70","TCP","54","[TCP Retransmission] 20  >  80 [SYN] Seq=0 Win=8192 Len=0"
"49","0.853332555","192.168.60.70","192.168.60.233","TCP","54","80  >  20 [RST, ACK] Seq=1 Ack=1 Win=0 Len=0"
"50","0.855606183","192.168.60.233","192.168.60.70","TCP","54","[TCP Retransmission] 20  >  80 [SYN] Seq=0 Win=8192 Len=0"
"51","0.855646475","192.168.60.70","192.168.60.233","TCP","54","80  >  20 [RST, ACK] Seq=1 Ack=1 Win=0 Len=0"
"52","0.857767381","192.168.60.233","192.168.60.70","TCP","54","[TCP Retransmission] 20  >  80 [SYN] Seq=0 Win=8192 Len=0"
"53","0.857814138","192.168.60.70","192.168.60.233","TCP","54","80  >  20 [RST, ACK] Seq=1 Ack=1 Win=0 Len=0"
"54","0.860311861","192.168.60.233","192.168.60.70","TCP","54","[TCP Retransmission] 20  >  80 [SYN] Seq=0 Win=8192 Len=0"
"55","0.860348816","192.168.60.70","192.168.60.233","TCP","54","80  >  20 [RST, ACK] Seq=1 Ack=1 Win=0 Len=0"
"56","0.862136954","192.168.60.233","192.168.60.70","TCP","54","[TCP Retransmission] 20  >  80 [SYN] Seq=0 Win=8192 Len=0"
"57","0.862166401","192.168.60.70","192.168.60.233","TCP","54","80  >  20 [RST, ACK] Seq=1 Ack=1 Win=0 Len=0"
"58","0.864819027","192.168.60.233","192.168.60.70","TCP","54","[TCP Retransmission] 20  >  80 [SYN] Seq=0 Win=8192 Len=0"
"59","0.864847808","192.168.60.70","192.168.60.233","TCP","54","80  >  20 [RST, ACK] Seq=1 Ack=1 Win=0 Len=0"
"60","0.867771467","192.168.60.233","192.168.60.70","TCP","54","[TCP Retransmission] 20  >  80 [SYN] Seq=0 Win=8192 Len=0"
"61","0.867811125","192.168.60.70","192.168.60.233","TCP","54","80  >  20 [RST, ACK] Seq=1 Ack=1 Win=0 Len=0"
"62","0.869532614","192.168.60.233","192.168.60.70","TCP","54","[TCP Retransmission] 20  >  80 [SYN] Seq=0 Win=8192 Len=0"
"63","0.869561214","192.168.60.70","192.168.60.233","TCP","54","80  >  20 [RST, ACK] Seq=1 Ack=1 Win=0 Len=0"
"64","0.872383260","192.168.60.233","192.168.60.70","TCP","54","[TCP Retransmission] 20  >  80 [SYN] Seq=0 Win=8192 Len=0"
"65","0.872417188","192.168.60.70","192.168.60.233","TCP","54","80  >  20 [RST, ACK] Seq=1 Ack=1 Win=0 Len=0"
"66","0.875721892","192.168.60.233","192.168.60.70","TCP","54","[TCP Retransmission] 20  >  80 [SYN] Seq=0 Win=8192 Len=0"
"67","0.875761519","192.168.60.70","192.168.60.233","TCP","54","80  >  20 [RST, ACK] Seq=1 Ack=1 Win=0 Len=0"
"68","0.887356138","192.168.60.233","192.168.60.70","TCP","54","[TCP Retransmission] 20  >  80 [SYN] Seq=0 Win=8192 Len=0"
"69","0.887388296","192.168.60.70","192.168.60.233","TCP","54","80  >  20 [RST, ACK] Seq=1 Ack=1 Win=0 Len=0"
"70","0.887574634","192.168.60.233","192.168.60.70","TCP","54","[TCP Retransmission] 20  >  80 [SYN] Seq=0 Win=8192 Len=0"
"71","0.887589780","192.168.60.70","192.168.60.233","TCP","54","80  >  20 [RST, ACK] Seq=1 Ack=1 Win=0 Len=0"
"72","0.888055289","192.168.60.233","192.168.60.70","TCP","54","[TCP Retransmission] 20  >  80 [SYN] Seq=0 Win=8192 Len=0"
"73","0.888098561","192.168.60.70","192.168.60.233","TCP","54","80  >  20 [RST, ACK] Seq=1 Ack=1 Win=0 Len=0"
"74","0.888211418","192.168.60.233","192.168.60.70","TCP","54","[TCP Retransmission] 20  >  80 [SYN] Seq=0 Win=8192 Len=0"
"75","0.888225411","192.168.60.70","192.168.60.233","TCP","54","80  >  20 [RST, ACK] Seq=1 Ack=1 Win=0 Len=0"
"76","0.888273090","192.168.60.233","192.168.60.70","TCP","54","[TCP Retransmission] 20  >  80 [SYN] Seq=0 Win=8192 Len=0"
"77","0.888282183","192.168.60.70","192.168.60.233","TCP","54","80  >  20 [RST, ACK] Seq=1 Ack=1 Win=0 Len=0"
"78","0.891146148","192.168.60.233","192.168.60.70","TCP","54","[TCP Retransmission] 20  >  80 [SYN] Seq=0 Win=8192 Len=0"
"79","0.891186455","192.168.60.70","192.168.60.233","TCP","54","80  >  20 [RST, ACK] Seq=1 Ack=1 Win=0 Len=0"
"80","0.892080320","192.168.60.233","192.168.60.70","TCP","54","[TCP Retransmission] 20  >  80 [SYN] Seq=0 Win=8192 Len=0"
"81","0.892120332","192.168.60.70","192.168.60.233","TCP","54","80  >  20 [RST, ACK] Seq=1 Ack=1 Win=0 Len=0"
"82","0.893988721","192.168.60.233","192.168.60.70","TCP","54","[TCP Retransmission] 20  >  80 [SYN] Seq=0 Win=8192 Len=0"
"83","0.894018473","192.168.60.70","192.168.60.233","TCP","54","80  >  20 [RST, ACK] Seq=1 Ack=1 Win=0 Len=0"
"84","0.897209039","192.168.60.233","192.168.60.70","TCP","54","[TCP Retransmission] 20  >  80 [SYN] Seq=0 Win=8192 Len=0"
"85","0.897249571","192.168.60.70","192.168.60.233","TCP","54","80  >  20 [RST, ACK] Seq=1 Ack=1 Win=0 Len=0"
"86","0.909250929","192.168.60.233","192.168.60.70","TCP","54","[TCP Retransmission] 20  >  80 [SYN] Seq=0 Win=8192 Len=0"
"87","0.909290394","192.168.60.70","192.168.60.233","TCP","54","80  >  20 [RST, ACK] Seq=1 Ack=1 Win=0 Len=0"
"88","0.909965271","192.168.60.233","192.168.60.70","TCP","54","[TCP Retransmission] 20  >  80 [SYN] Seq=0 Win=8192 Len=0"
"89","0.909991668","192.168.60.70","192.168.60.233","TCP","54","80  >  20 [RST, ACK] Seq=1 Ack=1 Win=0 Len=0"
"90","0.912823401","192.168.60.233","192.168.60.70","TCP","54","[TCP Retransmission] 20  >  80 [SYN] Seq=0 Win=8192 Len=0"
"91","0.912849849","192.168.60.70","192.168.60.233","TCP","54","80  >  20 [RST, ACK] Seq=1 Ack=1 Win=0 Len=0"
"92","0.915275846","192.168.60.233","192.168.60.70","TCP","54","[TCP Retransmission] 20  >  80 [SYN] Seq=0 Win=8192 Len=0"
"93","0.915316237","192.168.60.70","192.168.60.233","TCP","54","80  >  20 [RST, ACK] Seq=1 Ack=1 Win=0 Len=0"
"94","0.917367016","192.168.60.233","192.168.60.70","TCP","54","[TCP Retransmission] 20  >  80 [SYN] Seq=0 Win=8192 Len=0"
"95","0.917425859","192.168.60.70","192.168.60.233","TCP","54","80  >  20 [RST, ACK] Seq=1 Ack=1 Win=0 Len=0"
"96","0.919777423","192.168.60.233","192.168.60.70","TCP","54","[TCP Retransmission] 20  >  80 [SYN] Seq=0 Win=8192 Len=0"
"97","0.919817135","192.168.60.70","192.168.60.233","TCP","54","80  >  20 [RST, ACK] Seq=1 Ack=1 Win=0 Len=0"
"98","0.921896983","192.168.60.233","192.168.60.70","TCP","54","[TCP Retransmission] 20  >  80 [SYN] Seq=0 Win=8192 Len=0"
"99","0.921937152","192.168.60.70","192.168.60.233","TCP","54","80  >  20 [RST, ACK] Seq=1 Ack=1 Win=0 Len=0"
"100","0.925419355","192.168.60.233","192.168.60.70","TCP","54","[TCP Retransmission] 20  >  80 [SYN] Seq=0 Win=8192 Len=0"
"101","0.925460508","192.168.60.70","192.168.60.233","TCP","54","80  >  20 [RST, ACK] Seq=1 Ack=1 Win=0 Len=0"
"102","0.926749086","192.168.60.233","192.168.60.70","TCP","54","[TCP Retransmission] 20  >  80 [SYN] Seq=0 Win=8192 Len=0"
"103","0.926777960","192.168.60.70","192.168.60.233","TCP","54","80  >  20 [RST, ACK] Seq=1 Ack=1 Win=0 Len=0"
"104","0.929225261","192.168.60.233","192.168.60.70","TCP","54","[TCP Retransmission] 20  >  80 [SYN] Seq=0 Win=8192 Len=0"
"105","0.929255627","192.168.60.70","192.168.60.233","TCP","54","80  >  20 [RST, ACK] Seq=1 Ack=1 Win=0 Len=0"
"106","0.936741759","192.168.60.233","192.168.60.70","TCP","54","[TCP Retransmission] 20  >  80 [SYN] Seq=0 Win=8192 Len=0"
"107","0.936783745","192.168.60.70","192.168.60.233","TCP","54","80  >  20 [RST, ACK] Seq=1 Ack=1 Win=0 Len=0"
"108","0.936843746","192.168.60.233","192.168.60.70","TCP","54","[TCP Retransmission] 20  >  80 [SYN] Seq=0 Win=8192 Len=0"
"109","0.936855647","192.168.60.70","192.168.60.233","TCP","54","80  >  20 [RST, ACK] Seq=1 Ack=1 Win=0 Len=0"
"110","0.937054667","192.168.60.233","192.168.60.70","TCP","54","[TCP Retransmission] 20  >  80 [SYN] Seq=0 Win=8192 Len=0"
"111","0.937082866","192.168.60.70","192.168.60.233","TCP","54","80  >  20 [RST, ACK] Seq=1 Ack=1 Win=0 Len=0"
"112","0.939165599","192.168.60.233","192.168.60.70","TCP","54","[TCP Retransmission] 20  >  80 [SYN] Seq=0 Win=8192 Len=0"
"113","0.939208123","192.168.60.70","192.168.60.233","TCP","54","80  >  20 [RST, ACK] Seq=1 Ack=1 Win=0 Len=0"
"114","0.940852230","192.168.60.233","192.168.60.70","TCP","54","[TCP Retransmission] 20  >  80 [SYN] Seq=0 Win=8192 Len=0"
"115","0.940887893","192.168.60.70","192.168.60.233","TCP","54","80  >  20 [RST, ACK] Seq=1 Ack=1 Win=0 Len=0"
"116","0.943538429","192.168.60.233","192.168.60.70","TCP","54","[TCP Retransmission] 20  >  80 [SYN] Seq=0 Win=8192 Len=0"
"117","0.943580009","192.168.60.70","192.168.60.233","TCP","54","80  >  20 [RST, ACK] Seq=1 Ack=1 Win=0 Len=0"
"118","0.945366145","192.168.60.233","192.168.60.70","TCP","54","[TCP Retransmission] 20  >  80 [SYN] Seq=0 Win=8192 Len=0"
"119","0.945396822","192.168.60.70","192.168.60.233","TCP","54","80  >  20 [RST, ACK] Seq=1 Ack=1 Win=0 Len=0"
"120","0.948125658","192.168.60.233","192.168.60.70","TCP","54","[TCP Retransmission] 20  >  80 [SYN] Seq=0 Win=8192 Len=0"
"121","0.948172557","192.168.60.70","192.168.60.233","TCP","54","80  >  20 [RST, ACK] Seq=1 Ack=1 Win=0 Len=0"
"122","0.949972305","192.168.60.233","192.168.60.70","TCP","54","[TCP Retransmission] 20  >  80 [SYN] Seq=0 Win=8192 Len=0"
"123","0.949998353","192.168.60.70","192.168.60.233","TCP","54","80  >  20 [RST, ACK] Seq=1 Ack=1 Win=0 Len=0"
"124","0.953417217","192.168.60.233","192.168.60.70","TCP","54","[TCP Retransmission] 20  >  80 [SYN] Seq=0 Win=8192 Len=0"
"125","0.953450063","192.168.60.70","192.168.60.233","TCP","54","80  >  20 [RST, ACK] Seq=1 Ack=1 Win=0 Len=0"
"126","0.956099443","192.168.60.233","192.168.60.70","TCP","54","[TCP Retransmission] 20  >  80 [SYN] Seq=0 Win=8192 Len=0"
"127","0.956139105","192.168.60.70","192.168.60.233","TCP","54","80  >  20 [RST, ACK] Seq=1 Ack=1 Win=0 Len=0"
"128","0.957315567","192.168.60.233","192.168.60.70","TCP","54","[TCP Retransmission] 20  >  80 [SYN] Seq=0 Win=8192 Len=0"
"129","0.957342728","192.168.60.70","192.168.60.233","TCP","54","80  >  20 [RST, ACK] Seq=1 Ack=1 Win=0 Len=0"
"130","0.968578615","192.168.60.233","192.168.60.70","TCP","54","[TCP Retransmission] 20  >  80 [SYN] Seq=0 Win=8192 Len=0"
"131","0.968625334","192.168.60.70","192.168.60.233","TCP","54","80  >  20 [RST, ACK] Seq=1 Ack=1 Win=0 Len=0"
"132","0.968689893","192.168.60.233","192.168.60.70","TCP","54","[TCP Retransmission] 20  >  80 [SYN] Seq=0 Win=8192 Len=0"
"133","0.968700198","192.168.60.70","192.168.60.233","TCP","54","80  >  20 [RST, ACK] Seq=1 Ack=1 Win=0 Len=0"
"134","0.968743252","192.168.60.233","192.168.60.70","TCP","54","[TCP Retransmission] 20  >  80 [SYN] Seq=0 Win=8192 Len=0"
"135","0.968752692","192.168.60.70","192.168.60.233","TCP","54","80  >  20 [RST, ACK] Seq=1 Ack=1 Win=0 Len=0"
"136","0.968799240","192.168.60.233","192.168.60.70","TCP","54","[TCP Retransmission] 20  >  80 [SYN] Seq=0 Win=8192 Len=0"
"137","0.968808521","192.168.60.70","192.168.60.233","TCP","54","80  >  20 [RST, ACK] Seq=1 Ack=1 Win=0 Len=0"
"138","0.970037982","192.168.60.233","192.168.60.70","TCP","54","[TCP Retransmission] 20  >  80 [SYN] Seq=0 Win=8192 Len=0"
"139","0.970068846","192.168.60.70","192.168.60.233","TCP","54","80  >  20 [RST, ACK] Seq=1 Ack=1 Win=0 Len=0"
"140","0.972027211","192.168.60.233","192.168.60.70","TCP","54","[TCP Retransmission] 20  >  80 [SYN] Seq=0 Win=8192 Len=0"
"141","0.972067034","192.168.60.70","192.168.60.233","TCP","54","80  >  20 [RST, ACK] Seq=1 Ack=1 Win=0 Len=0"
"142","0.973953453","192.168.60.233","192.168.60.70","TCP","54","[TCP Retransmission] 20  >  80 [SYN] Seq=0 Win=8192 Len=0"
"143","0.973983517","192.168.60.70","192.168.60.233","TCP","54","80  >  20 [RST, ACK] Seq=1 Ack=1 Win=0 Len=0"
"144","0.975620614","192.168.60.233","192.168.60.70","TCP","54","[TCP Retransmission] 20  >  80 [SYN] Seq=0 Win=8192 Len=0"
"145","0.975649299","192.168.60.70","192.168.60.233","TCP","54","80  >  20 [RST, ACK] Seq=1 Ack=1 Win=0 Len=0"
"146","0.978905533","192.168.60.233","192.168.60.70","TCP","54","[TCP Retransmission] 20  >  80 [SYN] Seq=0 Win=8192 Len=0"
"147","0.978945393","192.168.60.70","192.168.60.233","TCP","54","80  >  20 [RST, ACK] Seq=1 Ack=1 Win=0 Len=0"
"148","0.981039999","192.168.60.233","192.168.60.70","TCP","54","[TCP Retransmission] 20  >  80 [SYN] Seq=0 Win=8192 Len=0"
"149","0.981080236","192.168.60.70","192.168.60.233","TCP","54","80  >  20 [RST, ACK] Seq=1 Ack=1 Win=0 Len=0"
"150","0.984084577","192.168.60.233","192.168.60.70","TCP","54","[TCP Retransmission] 20  >  80 [SYN] Seq=0 Win=8192 Len=0"
"151","0.984124706","192.168.60.70","192.168.60.233","TCP","54","80  >  20 [RST, ACK] Seq=1 Ack=1 Win=0 Len=0"
"152","0.985170932","192.168.60.233","192.168.60.70","TCP","54","[TCP Retransmission] 20  >  80 [SYN] Seq=0 Win=8192 Len=0"
"153","0.985211413","192.168.60.70","192.168.60.233","TCP","54","80  >  20 [RST, ACK] Seq=1 Ack=1 Win=0 Len=0"
"154","0.988415036","192.168.60.233","192.168.60.70","TCP","54","[TCP Retransmission] 20  >  80 [SYN] Seq=0 Win=8192 Len=0"
"155","0.988460382","192.168.60.70","192.168.60.233","TCP","54","80  >  20 [RST, ACK] Seq=1 Ack=1 Win=0 Len=0"
"156","0.990105404","192.168.60.233","192.168.60.70","TCP","54","[TCP Retransmission] 20  >  80 [SYN] Seq=0 Win=8192 Len=0"
"157","0.990131004","192.168.60.70","192.168.60.233","TCP","54","80  >  20 [RST, ACK] Seq=1 Ack=1 Win=0 Len=0"
"158","0.992806028","192.168.60.233","192.168.60.70","TCP","54","[TCP Retransmission] 20  >  80 [SYN] Seq=0 Win=8192 Len=0"
"159","0.992832920","192.168.60.70","192.168.60.233","TCP","54","80  >  20 [RST, ACK] Seq=1 Ack=1 Win=0 Len=0"
"160","0.995760875","192.168.60.233","192.168.60.70","TCP","54","[TCP Retransmission] 20  >  80 [SYN] Seq=0 Win=8192 Len=0"
"161","0.995802904","192.168.60.70","192.168.60.233","TCP","54","80  >  20 [RST, ACK] Seq=1 Ack=1 Win=0 Len=0"
"162","0.997910417","192.168.60.233","192.168.60.70","TCP","54","[TCP Retransmission] 20  >  80 [SYN] Seq=0 Win=8192 Len=0"
"163","0.997970790","192.168.60.70","192.168.60.233","TCP","54","80  >  20 [RST, ACK] Seq=1 Ack=1 Win=0 Len=0"
"164","0.999885503","192.168.60.233","192.168.60.70","TCP","54","[TCP Retransmission] 20  >  80 [SYN] Seq=0 Win=8192 Len=0"
"165","0.999930162","192.168.60.70","192.168.60.233","TCP","54","80  >  20 [RST, ACK] Seq=1 Ack=1 Win=0 Len=0"
"166","1.001894425","192.168.60.233","192.168.60.70","TCP","54","[TCP Retransmission] 20  >  80 [SYN] Seq=0 Win=8192 Len=0"
"167","1.001939166","192.168.60.70","192.168.60.233","TCP","54","80  >  20 [RST, ACK] Seq=1 Ack=1 Win=0 Len=0"
"168","1.004293572","192.168.60.233","192.168.60.70","TCP","54","[TCP Retransmission] 20  >  80 [SYN] Seq=0 Win=8192 Len=0"
"169","1.004358486","192.168.60.70","192.168.60.233","TCP","54","80  >  20 [RST, ACK] Seq=1 Ack=1 Win=0 Len=0"
"170","1.006581464","192.168.60.233","192.168.60.70","TCP","54","[TCP Retransmission] 20  >  80 [SYN] Seq=0 Win=8192 Len=0"
"171","1.006625483","192.168.60.70","192.168.60.233","TCP","54","80  >  20 [RST, ACK] Seq=1 Ack=1 Win=0 Len=0"
"172","1.008975242","192.168.60.233","192.168.60.70","TCP","54","[TCP Retransmission] 20  >  80 [SYN] Seq=0 Win=8192 Len=0"
"173","1.008999225","192.168.60.70","192.168.60.233","TCP","54","80  >  20 [RST, ACK] Seq=1 Ack=1 Win=0 Len=0"
"174","1.011012627","192.168.60.233","192.168.60.70","TCP","54","[TCP Retransmission] 20  >  80 [SYN] Seq=0 Win=8192 Len=0"
"175","1.011044795","192.168.60.70","192.168.60.233","TCP","54","80  >  20 [RST, ACK] Seq=1 Ack=1 Win=0 Len=0"
"176","1.015743229","192.168.60.233","192.168.60.70","TCP","54","[TCP Retransmission] 20  >  80 [SYN] Seq=0 Win=8192 Len=0"
"177","1.015786930","192.168.60.70","192.168.60.233","TCP","54","80  >  20 [RST, ACK] Seq=1 Ack=1 Win=0 Len=0"
"178","1.016062377","192.168.60.233","192.168.60.70","TCP","54","[TCP Retransmission] 20  >  80 [SYN] Seq=0 Win=8192 Len=0"
"179","1.016092941","192.168.60.70","192.168.60.233","TCP","54","80  >  20 [RST, ACK] Seq=1 Ack=1 Win=0 Len=0"
"180","1.017714252","192.168.60.233","192.168.60.70","TCP","54","[TCP Retransmission] 20  >  80 [SYN] Seq=0 Win=8192 Len=0"
"181","1.017753542","192.168.60.70","192.168.60.233","TCP","54","80  >  20 [RST, ACK] Seq=1 Ack=1 Win=0 Len=0"
"182","1.020812514","192.168.60.233","192.168.60.70","TCP","54","[TCP Retransmission] 20  >  80 [SYN] Seq=0 Win=8192 Len=0"
"183","1.020870793","192.168.60.70","192.168.60.233","TCP","54","80  >  20 [RST, ACK] Seq=1 Ack=1 Win=0 Len=0"
"184","1.022951236","192.168.60.233","192.168.60.70","TCP","54","[TCP Retransmission] 20  >  80 [SYN] Seq=0 Win=8192 Len=0"
"185","1.022996941","192.168.60.70","192.168.60.233","TCP","54","80  >  20 [RST, ACK] Seq=1 Ack=1 Win=0 Len=0"
"186","1.025329380","192.168.60.233","192.168.60.70","TCP","54","[TCP Retransmission] 20  >  80 [SYN] Seq=0 Win=8192 Len=0"
"187","1.025367495","192.168.60.70","192.168.60.233","TCP","54","80  >  20 [RST, ACK] Seq=1 Ack=1 Win=0 Len=0"
"188","1.027207067","192.168.60.233","192.168.60.70","TCP","54","[TCP Retransmission] 20  >  80 [SYN] Seq=0 Win=8192 Len=0"
"189","1.027254107","192.168.60.70","192.168.60.233","TCP","54","80  >  20 [RST, ACK] Seq=1 Ack=1 Win=0 Len=0"
"190","1.029678162","192.168.60.233","192.168.60.70","TCP","54","[TCP Retransmission] 20  >  80 [SYN] Seq=0 Win=8192 Len=0"
"191","1.029731259","192.168.60.70","192.168.60.233","TCP","54","80  >  20 [RST, ACK] Seq=1 Ack=1 Win=0 Len=0"
"192","1.032202490","192.168.60.233","192.168.60.70","TCP","54","[TCP Retransmission] 20  >  80 [SYN] Seq=0 Win=8192 Len=0"
"193","1.032261021","192.168.60.70","192.168.60.233","TCP","54","80  >  20 [RST, ACK] Seq=1 Ack=1 Win=0 Len=0"
"194","1.034584969","192.168.60.233","192.168.60.70","TCP","54","[TCP Retransmission] 20  >  80 [SYN] Seq=0 Win=8192 Len=0"
"195","1.034625761","192.168.60.70","192.168.60.233","TCP","54","80  >  20 [RST, ACK] Seq=1 Ack=1 Win=0 Len=0"
"196","1.039014850","192.168.60.233","192.168.60.70","TCP","54","[TCP Retransmission] 20  >  80 [SYN] Seq=0 Win=8192 Len=0"
"197","1.039067914","192.168.60.70","192.168.60.233","TCP","54","80  >  20 [RST, ACK] Seq=1 Ack=1 Win=0 Len=0"
"198","1.039270330","192.168.60.233","192.168.60.70","TCP","54","[TCP Retransmission] 20  >  80 [SYN] Seq=0 Win=8192 Len=0"
"199","1.039295640","192.168.60.70","192.168.60.233","TCP","54","80  >  20 [RST, ACK] Seq=1 Ack=1 Win=0 Len=0"
"200","1.041553712","192.168.60.233","192.168.60.70","TCP","54","[TCP Retransmission] 20  >  80 [SYN] Seq=0 Win=8192 Len=0"
"201","1.041603476","192.168.60.70","192.168.60.233","TCP","54","80  >  20 [RST, ACK] Seq=1 Ack=1 Win=0 Len=0"
"202","1.043714577","192.168.60.233","192.168.60.70","TCP","54","[TCP Retransmission] 20  >  80 [SYN] Seq=0 Win=8192 Len=0"
"203","1.043751474","192.168.60.70","192.168.60.233","TCP","54","80  >  20 [RST, ACK] Seq=1 Ack=1 Win=0 Len=0"
"204","1.046168090","192.168.60.233","192.168.60.70","TCP","54","[TCP Retransmission] 20  >  80 [SYN] Seq=0 Win=8192 Len=0"
"205","1.046208854","192.168.60.70","192.168.60.233","TCP","54","80  >  20 [RST, ACK] Seq=1 Ack=1 Win=0 Len=0"
"206","1.048908607","192.168.60.233","192.168.60.70","TCP","54","[TCP Retransmission] 20  >  80 [SYN] Seq=0 Win=8192 Len=0"
"207","1.048942411","192.168.60.70","192.168.60.233","TCP","54","80  >  20 [RST, ACK] Seq=1 Ack=1 Win=0 Len=0"
"208","1.051635026","192.168.60.233","192.168.60.70","TCP","54","[TCP Retransmission] 20  >  80 [SYN] Seq=0 Win=8192 Len=0"
"209","1.051691940","192.168.60.70","192.168.60.233","TCP","54","80  >  20 [RST, ACK] Seq=1 Ack=1 Win=0 Len=0"
"210","1.053517747","192.168.60.233","192.168.60.70","TCP","54","[TCP Retransmission] 20  >  80 [SYN] Seq=0 Win=8192 Len=0"
"211","1.053552726","192.168.60.70","192.168.60.233","TCP","54","80  >  20 [RST, ACK] Seq=1 Ack=1 Win=0 Len=0"
"212","1.055813975","192.168.60.233","192.168.60.70","TCP","54","[TCP Retransmission] 20  >  80 [SYN] Seq=0 Win=8192 Len=0"
"213","1.055846269","192.168.60.70","192.168.60.233","TCP","54","80  >  20 [RST, ACK] Seq=1 Ack=1 Win=0 Len=0"
"214","1.058042743","192.168.60.233","192.168.60.70","TCP","54","[TCP Retransmission] 20  >  80 [SYN] Seq=0 Win=8192 Len=0"
"215","1.058087482","192.168.60.70","192.168.60.233","TCP","54","80  >  20 [RST, ACK] Seq=1 Ack=1 Win=0 Len=0"
"216","1.060276355","192.168.60.233","192.168.60.70","TCP","54","[TCP Retransmission] 20  >  80 [SYN] Seq=0 Win=8192 Len=0"
"217","1.060320832","192.168.60.70","192.168.60.233","TCP","54","80  >  20 [RST, ACK] Seq=1 Ack=1 Win=0 Len=0"
"218","1.068304422","192.168.60.233","192.168.60.70","TCP","54","[TCP Retransmission] 20  >  80 [SYN] Seq=0 Win=8192 Len=0"
"219","1.068351543","192.168.60.70","192.168.60.233","TCP","54","80  >  20 [RST, ACK] Seq=1 Ack=1 Win=0 Len=0"
"220","1.068449442","192.168.60.233","192.168.60.70","TCP","54","[TCP Retransmission] 20  >  80 [SYN] Seq=0 Win=8192 Len=0"
"221","1.068470628","192.168.60.70","192.168.60.233","TCP","54","80  >  20 [RST, ACK] Seq=1 Ack=1 Win=0 Len=0"
"222","1.068576760","192.168.60.233","192.168.60.70","TCP","54","[TCP Retransmission] 20  >  80 [SYN] Seq=0 Win=8192 Len=0"
"223","1.068591894","192.168.60.70","192.168.60.233","TCP","54","80  >  20 [RST, ACK] Seq=1 Ack=1 Win=0 Len=0"
"224","1.072530254","192.168.60.233","192.168.60.70","TCP","54","[TCP Retransmission] 20  >  80 [SYN] Seq=0 Win=8192 Len=0"
"225","1.072586829","192.168.60.70","192.168.60.233","TCP","54","80  >  20 [RST, ACK] Seq=1 Ack=1 Win=0 Len=0"
"226","1.072748025","192.168.60.233","192.168.60.70","TCP","54","[TCP Retransmission] 20  >  80 [SYN] Seq=0 Win=8192 Len=0"
"227","1.072776482","192.168.60.70","192.168.60.233","TCP","54","80  >  20 [RST, ACK] Seq=1 Ack=1 Win=0 Len=0"
"228","1.076302764","192.168.60.233","192.168.60.70","TCP","54","[TCP Retransmission] 20  >  80 [SYN] Seq=0 Win=8192 Len=0"
"229","1.076359687","192.168.60.70","192.168.60.233","TCP","54","80  >  20 [RST, ACK] Seq=1 Ack=1 Win=0 Len=0"
"230","1.076684174","192.168.60.233","192.168.60.70","TCP","54","[TCP Retransmission] 20  >  80 [SYN] Seq=0 Win=8192 Len=0"
"231","1.076715062","192.168.60.70","192.168.60.233","TCP","54","80  >  20 [RST, ACK] Seq=1 Ack=1 Win=0 Len=0"
"232","1.078717935","192.168.60.233","192.168.60.70","TCP","54","[TCP Retransmission] 20  >  80 [SYN] Seq=0 Win=8192 Len=0"
"233","1.078752225","192.168.60.70","192.168.60.233","TCP","54","80  >  20 [RST, ACK] Seq=1 Ack=1 Win=0 Len=0"
"234","1.080980841","192.168.60.233","192.168.60.70","TCP","54","[TCP Retransmission] 20  >  80 [SYN] Seq=0 Win=8192 Len=0"
"235","1.081011701","192.168.60.70","192.168.60.233","TCP","54","80  >  20 [RST, ACK] Seq=1 Ack=1 Win=0 Len=0"
"236","1.084144578","192.168.60.233","192.168.60.70","TCP","54","[TCP Retransmission] 20  >  80 [SYN] Seq=0 Win=8192 Len=0"
"237","1.084181618","192.168.60.70","192.168.60.233","TCP","54","80  >  20 [RST, ACK] Seq=1 Ack=1 Win=0 Len=0"
"238","1.085863518","192.168.60.233","192.168.60.70","TCP","54","[TCP Retransmission] 20  >  80 [SYN] Seq=0 Win=8192 Len=0"
"239","1.085910165","192.168.60.70","192.168.60.233","TCP","54","80  >  20 [RST, ACK] Seq=1 Ack=1 Win=0 Len=0"
"240","1.088796966","192.168.60.233","192.168.60.70","TCP","54","[TCP Retransmission] 20  >  80 [SYN] Seq=0 Win=8192 Len=0"
"241","1.088827806","192.168.60.70","192.168.60.233","TCP","54","80  >  20 [RST, ACK] Seq=1 Ack=1 Win=0 Len=0"
"242","1.090565539","192.168.60.233","192.168.60.70","TCP","54","[TCP Retransmission] 20  >  80 [SYN] Seq=0 Win=8192 Len=0"
"243","1.090616349","192.168.60.70","192.168.60.233","TCP","54","80  >  20 [RST, ACK] Seq=1 Ack=1 Win=0 Len=0"
"244","1.092863613","192.168.60.233","192.168.60.70","TCP","54","[TCP Retransmission] 20  >  80 [SYN] Seq=0 Win=8192 Len=0"
"245","1.092921216","192.168.60.70","192.168.60.233","TCP","54","80  >  20 [RST, ACK] Seq=1 Ack=1 Win=0 Len=0"
"246","1.096962210","192.168.60.233","192.168.60.70","TCP","54","[TCP Retransmission] 20  >  80 [SYN] Seq=0 Win=8192 Len=0"
"247","1.096999238","192.168.60.70","192.168.60.233","TCP","54","80  >  20 [RST, ACK] Seq=1 Ack=1 Win=0 Len=0"
"248","1.097787975","192.168.60.233","192.168.60.70","TCP","54","[TCP Retransmission] 20  >  80 [SYN] Seq=0 Win=8192 Len=0"
"249","1.097824206","192.168.60.70","192.168.60.233","TCP","54","80  >  20 [RST, ACK] Seq=1 Ack=1 Win=0 Len=0"
"250","1.100352560","192.168.60.233","192.168.60.70","TCP","54","[TCP Retransmission] 20  >  80 [SYN] Seq=0 Win=8192 Len=0"
"251","1.100401328","192.168.60.70","192.168.60.233","TCP","54","80  >  20 [RST, ACK] Seq=1 Ack=1 Win=0 Len=0"
"252","1.101859633","192.168.60.233","192.168.60.70","TCP","54","[TCP Retransmission] 20  >  80 [SYN] Seq=0 Win=8192 Len=0"
"253","1.101921510","192.168.60.70","192.168.60.233","TCP","54","80  >  20 [RST, ACK] Seq=1 Ack=1 Win=0 Len=0"
"254","1.104872190","192.168.60.233","192.168.60.70","TCP","54","[TCP Retransmission] 20  >  80 [SYN] Seq=0 Win=8192 Len=0"
"255","1.104919535","192.168.60.70","192.168.60.233","TCP","54","80  >  20 [RST, ACK] Seq=1 Ack=1 Win=0 Len=0"
"256","1.107715033","192.168.60.233","192.168.60.70","TCP","54","[TCP Retransmission] 20  >  80 [SYN] Seq=0 Win=8192 Len=0"
"257","1.107756704","192.168.60.70","192.168.60.233","TCP","54","80  >  20 [RST, ACK] Seq=1 Ack=1 Win=0 Len=0"
"258","1.109196966","192.168.60.233","192.168.60.70","TCP","54","[TCP Retransmission] 20  >  80 [SYN] Seq=0 Win=8192 Len=0"
"259","1.109232113","192.168.60.70","192.168.60.233","TCP","54","80  >  20 [RST, ACK] Seq=1 Ack=1 Win=0 Len=0"
"260","1.112061738","192.168.60.233","192.168.60.70","TCP","54","[TCP Retransmission] 20  >  80 [SYN] Seq=0 Win=8192 Len=0"
"261","1.112102750","192.168.60.70","192.168.60.233","TCP","54","80  >  20 [RST, ACK] Seq=1 Ack=1 Win=0 Len=0"
"262","1.113623926","192.168.60.233","192.168.60.70","TCP","54","[TCP Retransmission] 20  >  80 [SYN] Seq=0 Win=8192 Len=0"
"263","1.113663271","192.168.60.70","192.168.60.233","TCP","54","80  >  20 [RST, ACK] Seq=1 Ack=1 Win=0 Len=0"
"264","1.116200784","192.168.60.233","192.168.60.70","TCP","54","[TCP Retransmission] 20  >  80 [SYN] Seq=0 Win=8192 Len=0"
"265","1.116248454","192.168.60.70","192.168.60.233","TCP","54","80  >  20 [RST, ACK] Seq=1 Ack=1 Win=0 Len=0"
"266","1.119358712","192.168.60.233","192.168.60.70","TCP","54","[TCP Retransmission] 20  >  80 [SYN] Seq=0 Win=8192 Len=0"
"267","1.119426130","192.168.60.70","192.168.60.233","TCP","54","80  >  20 [RST, ACK] Seq=1 Ack=1 Win=0 Len=0"
"268","1.129546291","192.168.60.233","192.168.60.70","TCP","54","[TCP Retransmission] 20  >  80 [SYN] Seq=0 Win=8192 Len=0"
"269","1.129598956","192.168.60.70","192.168.60.233","TCP","54","80  >  20 [RST, ACK] Seq=1 Ack=1 Win=0 Len=0"
"270","1.129971582","192.168.60.233","192.168.60.70","TCP","54","[TCP Retransmission] 20  >  80 [SYN] Seq=0 Win=8192 Len=0"
"271","1.129989831","192.168.60.70","192.168.60.233","TCP","54","80  >  20 [RST, ACK] Seq=1 Ack=1 Win=0 Len=0"
"272","1.130267701","192.168.60.233","192.168.60.70","TCP","54","[TCP Retransmission] 20  >  80 [SYN] Seq=0 Win=8192 Len=0"
"273","1.130291018","192.168.60.70","192.168.60.233","TCP","54","80  >  20 [RST, ACK] Seq=1 Ack=1 Win=0 Len=0"
"274","1.131014457","192.168.60.233","192.168.60.70","TCP","54","[TCP Retransmission] 20  >  80 [SYN] Seq=0 Win=8192 Len=0"
"275","1.131033877","192.168.60.70","192.168.60.233","TCP","54","80  >  20 [RST, ACK] Seq=1 Ack=1 Win=0 Len=0"
"276","1.131386089","192.168.60.233","192.168.60.70","TCP","54","[TCP Retransmission] 20  >  80 [SYN] Seq=0 Win=8192 Len=0"
"277","1.131401112","192.168.60.70","192.168.60.233","TCP","54","80  >  20 [RST, ACK] Seq=1 Ack=1 Win=0 Len=0"
"278","1.132650359","192.168.60.233","192.168.60.70","TCP","54","[TCP Retransmission] 20  >  80 [SYN] Seq=0 Win=8192 Len=0"
"279","1.132681359","192.168.60.70","192.168.60.233","TCP","54","80  >  20 [RST, ACK] Seq=1 Ack=1 Win=0 Len=0"
"280","1.135155380","192.168.60.233","192.168.60.70","TCP","54","[TCP Retransmission] 20  >  80 [SYN] Seq=0 Win=8192 Len=0"
"281","1.135193393","192.168.60.70","192.168.60.233","TCP","54","80  >  20 [RST, ACK] Seq=1 Ack=1 Win=0 Len=0"
"282","1.136986157","192.168.60.233","192.168.60.70","TCP","54","[TCP Retransmission] 20  >  80 [SYN] Seq=0 Win=8192 Len=0"
"283","1.137019135","192.168.60.70","192.168.60.233","TCP","54","80  >  20 [RST, ACK] Seq=1 Ack=1 Win=0 Len=0"
"284","1.141077006","192.168.60.233","192.168.60.70","TCP","54","[TCP Retransmission] 20  >  80 [SYN] Seq=0 Win=8192 Len=0"
"285","1.141128787","192.168.60.70","192.168.60.233","TCP","54","80  >  20 [RST, ACK] Seq=1 Ack=1 Win=0 Len=0"
"286","1.142349330","192.168.60.233","192.168.60.70","TCP","54","[TCP Retransmission] 20  >  80 [SYN] Seq=0 Win=8192 Len=0"
"287","1.142391037","192.168.60.70","192.168.60.233","TCP","54","80  >  20 [RST, ACK] Seq=1 Ack=1 Win=0 Len=0"
"288","1.144140377","192.168.60.233","192.168.60.70","TCP","54","[TCP Retransmission] 20  >  80 [SYN] Seq=0 Win=8192 Len=0"
"289","1.144173476","192.168.60.70","192.168.60.233","TCP","54","80  >  20 [RST, ACK] Seq=1 Ack=1 Win=0 Len=0"
"290","1.146698781","192.168.60.233","192.168.60.70","TCP","54","[TCP Retransmission] 20  >  80 [SYN] Seq=0 Win=8192 Len=0"
"291","1.146744916","192.168.60.70","192.168.60.233","TCP","54","80  >  20 [RST, ACK] Seq=1 Ack=1 Win=0 Len=0"
"292","1.149076916","192.168.60.233","192.168.60.70","TCP","54","[TCP Retransmission] 20  >  80 [SYN] Seq=0 Win=8192 Len=0"
"293","1.149124863","192.168.60.70","192.168.60.233","TCP","54","80  >  20 [RST, ACK] Seq=1 Ack=1 Win=0 Len=0"
"294","1.151021236","192.168.60.233","192.168.60.70","TCP","54","[TCP Retransmission] 20  >  80 [SYN] Seq=0 Win=8192 Len=0"
"295","1.151062346","192.168.60.70","192.168.60.233","TCP","54","80  >  20 [RST, ACK] Seq=1 Ack=1 Win=0 Len=0"
"296","1.153521776","192.168.60.233","192.168.60.70","TCP","54","[TCP Retransmission] 20  >  80 [SYN] Seq=0 Win=8192 Len=0"
"297","1.153571187","192.168.60.70","192.168.60.233","TCP","54","80  >  20 [RST, ACK] Seq=1 Ack=1 Win=0 Len=0"
"298","1.155998388","192.168.60.233","192.168.60.70","TCP","54","[TCP Retransmission] 20  >  80 [SYN] Seq=0 Win=8192 Len=0"
"299","1.156050896","192.168.60.70","192.168.60.233","TCP","54","80  >  20 [RST, ACK] Seq=1 Ack=1 Win=0 Len=0"
"300","1.159297604","192.168.60.233","192.168.60.70","TCP","54","[TCP Retransmission] 20  >  80 [SYN] Seq=0 Win=8192 Len=0"
"301","1.159347729","192.168.60.70","192.168.60.233","TCP","54","80  >  20 [RST, ACK] Seq=1 Ack=1 Win=0 Len=0"
"302","1.160379573","192.168.60.233","192.168.60.70","TCP","54","[TCP Retransmission] 20  >  80 [SYN] Seq=0 Win=8192 Len=0"
"303","1.160411039","192.168.60.70","192.168.60.233","TCP","54","80  >  20 [RST, ACK] Seq=1 Ack=1 Win=0 Len=0"
"304","1.162869406","192.168.60.233","192.168.60.70","TCP","54","[TCP Retransmission] 20  >  80 [SYN] Seq=0 Win=8192 Len=0"
"305","1.162904076","192.168.60.70","192.168.60.233","TCP","54","80  >  20 [RST, ACK] Seq=1 Ack=1 Win=0 Len=0"
"306","1.164793834","192.168.60.233","192.168.60.70","TCP","54","[TCP Retransmission] 20  >  80 [SYN] Seq=0 Win=8192 Len=0"
"307","1.164839061","192.168.60.70","192.168.60.233","TCP","54","80  >  20 [RST, ACK] Seq=1 Ack=1 Win=0 Len=0"
"308","1.167264732","192.168.60.233","192.168.60.70","TCP","54","[TCP Retransmission] 20  >  80 [SYN] Seq=0 Win=8192 Len=0"
"309","1.167313869","192.168.60.70","192.168.60.233","TCP","54","80  >  20 [RST, ACK] Seq=1 Ack=1 Win=0 Len=0"
"310","1.169694612","192.168.60.233","192.168.60.70","TCP","54","[TCP Retransmission] 20  >  80 [SYN] Seq=0 Win=8192 Len=0"
"311","1.169730844","192.168.60.70","192.168.60.233","TCP","54","80  >  20 [RST, ACK] Seq=1 Ack=1 Win=0 Len=0"
"312","1.172096648","192.168.60.233","192.168.60.70","TCP","54","[TCP Retransmission] 20  >  80 [SYN] Seq=0 Win=8192 Len=0"
"313","1.172134551","192.168.60.70","192.168.60.233","TCP","54","80  >  20 [RST, ACK] Seq=1 Ack=1 Win=0 Len=0"
"314","1.174499878","192.168.60.233","192.168.60.70","TCP","54","[TCP Retransmission] 20  >  80 [SYN] Seq=0 Win=8192 Len=0"
"315","1.174562159","192.168.60.70","192.168.60.233","TCP","54","80  >  20 [RST, ACK] Seq=1 Ack=1 Win=0 Len=0"
"316","1.182115688","192.168.60.233","192.168.60.70","TCP","54","[TCP Retransmission] 20  >  80 [SYN] Seq=0 Win=8192 Len=0"
"317","1.182159851","192.168.60.70","192.168.60.233","TCP","54","80  >  20 [RST, ACK] Seq=1 Ack=1 Win=0 Len=0"
"318","1.182437733","192.168.60.233","192.168.60.70","TCP","54","[TCP Retransmission] 20  >  80 [SYN] Seq=0 Win=8192 Len=0"
"319","1.182477306","192.168.60.70","192.168.60.233","TCP","54","80  >  20 [RST, ACK] Seq=1 Ack=1 Win=0 Len=0"
"320","1.182556859","192.168.60.233","192.168.60.70","TCP","54","[TCP Retransmission] 20  >  80 [SYN] Seq=0 Win=8192 Len=0"
"321","1.182571251","192.168.60.70","192.168.60.233","TCP","54","80  >  20 [RST, ACK] Seq=1 Ack=1 Win=0 Len=0"
"322","1.184190909","192.168.60.233","192.168.60.70","TCP","54","[TCP Retransmission] 20  >  80 [SYN] Seq=0 Win=8192 Len=0"
"323","1.184224073","192.168.60.70","192.168.60.233","TCP","54","80  >  20 [RST, ACK] Seq=1 Ack=1 Win=0 Len=0"
"324","1.185663942","192.168.60.233","192.168.60.70","TCP","54","[TCP Retransmission] 20  >  80 [SYN] Seq=0 Win=8192 Len=0"
"325","1.185700846","192.168.60.70","192.168.60.233","TCP","54","80  >  20 [RST, ACK] Seq=1 Ack=1 Win=0 Len=0"
"326","1.189100571","192.168.60.233","192.168.60.70","TCP","54","[TCP Retransmission] 20  >  80 [SYN] Seq=0 Win=8192 Len=0"
"327","1.189152341","192.168.60.70","192.168.60.233","TCP","54","80  >  20 [RST, ACK] Seq=1 Ack=1 Win=0 Len=0"
"328","1.190903069","192.168.60.233","192.168.60.70","TCP","54","[TCP Retransmission] 20  >  80 [SYN] Seq=0 Win=8192 Len=0"
"329","1.190938841","192.168.60.70","192.168.60.233","TCP","54","80  >  20 [RST, ACK] Seq=1 Ack=1 Win=0 Len=0"
"330","1.193434651","192.168.60.233","192.168.60.70","TCP","54","[TCP Retransmission] 20  >  80 [SYN] Seq=0 Win=8192 Len=0"
"331","1.193480310","192.168.60.70","192.168.60.233","TCP","54","80  >  20 [RST, ACK] Seq=1 Ack=1 Win=0 Len=0"
"332","1.194789159","192.168.60.233","192.168.60.70","TCP","54","[TCP Retransmission] 20  >  80 [SYN] Seq=0 Win=8192 Len=0"
"333","1.194825885","192.168.60.70","192.168.60.233","TCP","54","80  >  20 [RST, ACK] Seq=1 Ack=1 Win=0 Len=0"
"334","1.197255549","192.168.60.233","192.168.60.70","TCP","54","[TCP Retransmission] 20  >  80 [SYN] Seq=0 Win=8192 Len=0"
"335","1.197292310","192.168.60.70","192.168.60.233","TCP","54","80  >  20 [RST, ACK] Seq=1 Ack=1 Win=0 Len=0"
"336","1.199661731","192.168.60.233","192.168.60.70","TCP","54","[TCP Retransmission] 20  >  80 [SYN] Seq=0 Win=8192 Len=0"
"337","1.199706749","192.168.60.70","192.168.60.233","TCP","54","80  >  20 [RST, ACK] Seq=1 Ack=1 Win=0 Len=0"
"338","1.201727377","192.168.60.233","192.168.60.70","TCP","54","[TCP Retransmission] 20  >  80 [SYN] Seq=0 Win=8192 Len=0"
"339","1.201774638","192.168.60.70","192.168.60.233","TCP","54","80  >  20 [RST, ACK] Seq=1 Ack=1 Win=0 Len=0"
